source_href,name_hotel,region,description,price_label,rating,rating_type,review_count
https://www.booking.com/hotel/id/bali-tree-house-pelangi.html?sid=b9709cd8ce176378f5bf317f22dd8ee4&aid=2230186&ucfs=1&arphpl=1&dest_id=835&dest_type=region&group_adults=2&req_adults=2&no_rooms=1&group_children=0&req_children=0&hpos=17&hapos=717&sr_order=popularity&srpvid=f0c23a7c639c0165&srepoch=1685175666&map_fdco=1&from=searchresults#hotelTmpl,Bali Tree House Pelangi,Bedugul,"Located in Bedugul, 23 miles from Blanco Museum, and Ubud Monkey Forest reachable within 23 miles, Bali Tree House Pelangi offers a garden, a bar and free WiFi.",Expensive,8.2,Good,127
https://www.booking.com/hotel/id/anahata-villas-and-spa-resort.html?sid=b9709cd8ce176378f5bf317f22dd8ee4&aid=2230186&ucfs=1&arphpl=1&dest_id=835&dest_type=region&group_adults=2&req_adults=2&no_rooms=1&group_children=0&req_children=0&hpos=18&hapos=718&sr_order=popularity&srpvid=f0c23a7c639c0165&srepoch=1685175666&map_fdco=1&from=searchresults#hotelTmpl,Anahata Villas and Spa Resort,Ubud,"Offering free shuttle service to and from Ubud Market, Anahata Villas and Spa Resort features spacious villas with private pools and gardens. A spa and pool with jacuzzi are provided.",Cheap,8.2,Good,54
https://www.booking.com/hotel/id/umah-tikari-guesthouse.html?sid=b9709cd8ce176378f5bf317f22dd8ee4&aid=2230186&ucfs=1&arphpl=1&dest_id=835&dest_type=region&group_adults=2&req_adults=2&no_rooms=1&group_children=0&req_children=0&hpos=19&hapos=719&sr_order=popularity&srpvid=f0c23a7c639c0165&srepoch=1685175666&map_fdco=1&from=searchresults#hotelTmpl,Umah Tikari Guesthouse,"Babakan, Canggu","Located 5.8 miles from Tanah Lot Temple, Umah Tikari Guesthouse offers 2-star accommodations in Canggu and features a garden, a shared lounge and a terrace.",Moderate,9.5,Exceptional,21
https://www.booking.com/hotel/id/sania-s-house.html?sid=b9709cd8ce176378f5bf317f22dd8ee4&aid=2230186&ucfs=1&arphpl=1&dest_id=835&dest_type=region&group_adults=2&req_adults=2&no_rooms=1&group_children=0&req_children=0&hpos=20&hapos=720&sr_order=popularity&srpvid=f0c23a7c639c0165&srepoch=1685175666&from_sustainable_property_sr=1&map_fdco=1&from=searchresults#hotelTmpl,Sania's House,"Downtown Ubud, Ubud","Sania's, housed in a traditional Balinese-style building, features stunning wall carvings and stone columns. Just 164 feet from Ubud Center, it also has free Wi-Fi in public areas and an outdoor pool....",Moderate,7.2,Good,577
https://www.booking.com/hotel/id/the-vira-bali.html?sid=b9709cd8ce176378f5bf317f22dd8ee4&aid=2230186&ucfs=1&arphpl=1&dest_id=835&dest_type=region&group_adults=2&req_adults=2&no_rooms=1&group_children=0&req_children=0&hpos=21&hapos=721&sr_order=popularity&srpvid=f0c23a7c639c0165&srepoch=1685175666&from_sustainable_property_sr=1&map_fdco=1&from=searchresults#hotelTmpl,The Vira Bali Boutique Hotel & Suite,"Kartika Plaza, Kuta","The Vira Bali Boutique Hotel & Suite is located only 328 feet from South Kuta Beach. It offers an outdoor pool, a kids pool and a spa center.",Expensive,8.6,Exceptional,863
https://www.booking.com/hotel/id/kaamala-resort-ubud.html?sid=b9709cd8ce176378f5bf317f22dd8ee4&aid=2230186&ucfs=1&arphpl=1&dest_id=835&dest_type=region&group_adults=2&req_adults=2&no_rooms=1&group_children=0&req_children=0&hpos=22&hapos=722&sr_order=popularity&srpvid=f0c23a7c639c0165&srepoch=1685175666&from_sustainable_property_sr=1&map_fdco=1&from=searchresults#hotelTmpl,Kaamala Resort Ubud by Ini Vie Hospitality,"Downtown Ubud, Ubud","Located conveniently in Ubud, Kaamala Resort Ubud by Ini Vie Hospitality has air-conditioned rooms, an outdoor swimming pool, free WiFi and a fitness center.",Cheap,8.8,Exceptional,247
https://www.booking.com/hotel/id/the-ubud-village.html?sid=b9709cd8ce176378f5bf317f22dd8ee4&aid=2230186&ucfs=1&arphpl=1&dest_id=835&dest_type=region&group_adults=2&req_adults=2&no_rooms=1&group_children=0&req_children=0&hpos=23&hapos=723&sr_order=popularity&srpvid=f0c23a7c639c0165&srepoch=1685175666&from_sustainable_property_sr=1&map_fdco=1&from=searchresults#hotelTmpl,Ubud Village Hotel,"Downtown Ubud, Ubud","Less than a 10-minute walk from Ubud Market and Ubud Palace, Ubud Village Hotel offers two swimming pools, a restaurant, a coffee shop and a spa center.",Cheap,8.5,Good,333
https://www.booking.com/hotel/id/amarea-ubud.html?sid=b9709cd8ce176378f5bf317f22dd8ee4&aid=2230186&ucfs=1&arphpl=1&dest_id=835&dest_type=region&group_adults=2&req_adults=2&no_rooms=1&group_children=0&req_children=0&hpos=24&hapos=724&sr_order=popularity&srpvid=f0c23a7c639c0165&srepoch=1685175666&from_sustainable_property_sr=1&map_fdco=1&from=searchresults#hotelTmpl,Amarea Resort Ubud by Ini Vie Hospitality,"Peliatan, Ubud","Located in Ubud, 1.2 miles from Goa Gajah, Amarea Resort Ubud by Ini Vie Hospitality provides accommodations with an outdoor swimming pool, free private parking, a garden and a shared lounge.",Expensive,9.1,Wonderful,102
https://www.booking.com/hotel/id/santai.html?sid=b9709cd8ce176378f5bf317f22dd8ee4&aid=2230186&ucfs=1&arphpl=1&dest_id=835&dest_type=region&group_adults=2&req_adults=2&no_rooms=1&group_children=0&req_children=0&hpos=25&hapos=725&sr_order=popularity&srpvid=f0c23a7c639c0165&srepoch=1685175666&map_fdco=1&from=searchresults#hotelTmpl,Santai Hotel,Amed,"A relaxing oasis located in the Northeast of Bali, right on Amed Beach, Santai Hotel provides beautiful Indonesian-style accommodations with private terraces.",Expensive,8.1,Good,177
https://www.booking.com/hotel/id/gumi-ayu.html?sid=b9709cd8ce176378f5bf317f22dd8ee4&aid=2230186&ucfs=1&arphpl=1&dest_id=835&dest_type=region&group_adults=2&req_adults=2&no_rooms=1&group_children=0&req_children=0&hpos=2&hapos=727&sr_order=popularity&srpvid=f0c23a7c639c0165&srepoch=1685175667&map_fdco=1&from=searchresults#hotelTmpl,Gumi Ayu EcoHotel,Munduk,"Gumi Ayu EcoHotel has a garden, terrace, a restaurant and bar in Munduk. Some accommodations at the property have a patio with a river view. At the inn, the rooms include a balcony.",Expensive,9.1,Wonderful,278
https://www.booking.com/hotel/id/amarta-pasut-beach-retreat.html?sid=b9709cd8ce176378f5bf317f22dd8ee4&aid=2230186&ucfs=1&arphpl=1&dest_id=835&dest_type=region&group_adults=2&req_adults=2&no_rooms=1&group_children=0&req_children=0&hpos=3&hapos=728&sr_order=popularity&srpvid=f0c23a7c639c0165&srepoch=1685175667&from_sustainable_property_sr=1&map_fdco=1&from=searchresults#hotelTmpl,Amarta Beach Retreat by Nakula,Tabanan,"Located in Tabanan Regency, along the southwest coast of Bali, Amarta Beach Retreat by Nakula is a beachfront boutique resort. The property is a 30-minute drive from the Butterfly Park.",Expensive,8.9,Exceptional,130
https://www.booking.com/hotel/id/warung-bagia-bungalows.html?sid=b9709cd8ce176378f5bf317f22dd8ee4&aid=2230186&ucfs=1&arphpl=1&dest_id=835&dest_type=region&group_adults=2&req_adults=2&no_rooms=1&group_children=0&req_children=0&hpos=4&hapos=729&sr_order=popularity&srpvid=f0c23a7c639c0165&srepoch=1685175667&from_sustainable_property_sr=1&map_fdco=1&from=searchresults#hotelTmpl,Bagia Bungalows,Nusa Penida,"Located in Nusa Penida, 6.1 miles from Seganing Waterfall, Bagia Bungalows has accommodations with a garden, free private parking and a terrace.",Expensive,9.1,Wonderful,215
https://www.booking.com/hotel/id/the-breezes-bali-resort-spa.html?sid=b9709cd8ce176378f5bf317f22dd8ee4&aid=2230186&ucfs=1&arphpl=1&dest_id=835&dest_type=region&group_adults=2&req_adults=2&no_rooms=1&group_children=0&req_children=0&hpos=5&hapos=730&sr_order=popularity&srpvid=f0c23a7c639c0165&srepoch=1685175667&from_sustainable_property_sr=1&map_fdco=1&from=searchresults#hotelTmpl,Blu-Zea Resort by Double-Six,"Dyanapura, Seminyak","About 1640 feet from Seminyak Beach, Blu-Zea Resort by Double-Six offers a tropical getaway with its 4-tiered lagoon swimming pool.",Expensive,8.8,Exceptional,652
https://www.booking.com/hotel/id/the-acala-seri-sedana.html?sid=b9709cd8ce176378f5bf317f22dd8ee4&aid=2230186&ucfs=1&arphpl=1&dest_id=835&dest_type=region&group_adults=2&req_adults=2&no_rooms=1&group_children=0&req_children=0&hpos=6&hapos=731&sr_order=popularity&srpvid=f0c23a7c639c0165&srepoch=1685175667&from_sustainable_property_sr=1&map_fdco=1&from=searchresults#hotelTmpl,The Acala Shri Sedana,"Mushroom Bay, Nusa Lembongan","Set in Nusa Lembongan, The Acala Shri Sedana is 1.2 mi from Mushroom Bay. Among the various facilities are an outdoor swimming pool, a garden, as well as a terrace.",Expensive,8.6,Exceptional,207
https://www.booking.com/hotel/id/mule-malu-kabupaten-badung1.html?sid=b9709cd8ce176378f5bf317f22dd8ee4&aid=2230186&ucfs=1&arphpl=1&dest_id=835&dest_type=region&group_adults=2&req_adults=2&no_rooms=1&group_children=0&req_children=0&hpos=7&hapos=732&sr_order=popularity&srpvid=f0c23a7c639c0165&srepoch=1685175667&from_sustainable_property_sr=1&map_fdco=1&from=searchresults#hotelTmpl,Mule Malu Tropical Stay,"Bingin, Uluwatu","Set near well-known surf spots in Uluwatu, Mule Malu Tropical Stay offers accommodations with a salt-water pool and free WiFi in all areas.",Expensive,9.3,Wonderful,435
https://www.booking.com/hotel/id/the-aroma-villa-munduk.html?sid=b9709cd8ce176378f5bf317f22dd8ee4&aid=2230186&ucfs=1&arphpl=1&dest_id=835&dest_type=region&group_adults=2&req_adults=2&no_rooms=1&group_children=0&req_children=0&hpos=8&hapos=733&sr_order=popularity&srpvid=f0c23a7c639c0165&srepoch=1685175667&from_sustainable_property_sr=1&map_fdco=1&from=searchresults#hotelTmpl,The Aroma Villa Munduk,Mayong,"The Aroma Villa Munduk features an outdoor swimming pool, garden, a terrace and restaurant in Mayong.",Expensive,9.7,Exceptional,42
https://www.booking.com/hotel/id/good-cheer-lembongan-hostel.html?sid=b9709cd8ce176378f5bf317f22dd8ee4&aid=2230186&ucfs=1&arphpl=1&dest_id=835&dest_type=region&group_adults=2&req_adults=2&no_rooms=1&group_children=0&req_children=0&hpos=9&hapos=734&sr_order=popularity&srpvid=f0c23a7c639c0165&srepoch=1685175667&map_fdco=1&from=searchresults#hotelTmpl,Good Cheer Hostel,"Jungut Batu, Nusa Lembongan","Located in Nusa Lembongan, a 6-minute walk from Paradise Beach, Good Cheer Hostel provides accommodations with a garden, free private parking, a shared lounge and a terrace.",Moderate,7.9,Good,51
https://www.booking.com/hotel/id/kebun-indah.html?sid=b9709cd8ce176378f5bf317f22dd8ee4&aid=2230186&ucfs=1&arphpl=1&dest_id=835&dest_type=region&group_adults=2&req_adults=2&no_rooms=1&group_children=0&req_children=0&hpos=10&hapos=735&sr_order=popularity&srpvid=f0c23a7c639c0165&srepoch=1685175667&from_sustainable_property_sr=1&map_fdco=1&from=searchresults#hotelTmpl,Kebun Indah Ubud,"Pengosekan, Ubud","Kebun Indah Ubud features a garden, terrace, a restaurant and bar in Ubud. With an outdoor swimming pool, the 4-star hotel has air-conditioned rooms with free WiFi, each with a private bathroom.",Moderate,9.4,Wonderful,133
https://www.booking.com/hotel/id/the-ritz-carlton-bali.html?sid=b9709cd8ce176378f5bf317f22dd8ee4&aid=2230186&ucfs=1&arphpl=1&dest_id=835&dest_type=region&group_adults=2&req_adults=2&no_rooms=1&group_children=0&req_children=0&hpos=11&hapos=736&sr_order=popularity&srpvid=f0c23a7c639c0165&srepoch=1685175667&from_sustainable_property_sr=1&map_fdco=1&from=searchresults#hotelTmpl,The Ritz-Carlton Bali,"Sawangan, Nusa Dua","Facing towards the Indian ocean, The Ritz-Carlton Bali offers a tropical getaway in Nusa Dua.",Expensive,8.9,Exceptional,320
https://www.booking.com/hotel/id/jagi-villa.html?sid=b9709cd8ce176378f5bf317f22dd8ee4&aid=2230186&ucfs=1&arphpl=1&dest_id=835&dest_type=region&group_adults=2&req_adults=2&no_rooms=1&group_children=0&req_children=0&hpos=12&hapos=737&sr_order=popularity&srpvid=f0c23a7c639c0165&srepoch=1685175667&from_sustainable_property_sr=1&map_fdco=1&from=searchresults#hotelTmpl,Jagi Villa,"Sayan, Ubud","Surrounded by rice fields, Jagi Villa features a private pool and a large private terrace with a day bed. Free Wi-Fi is accessible throughout the property.",Moderate,8.9,Exceptional,158
https://www.booking.com/hotel/id/discovery-kartika-plaza.html?sid=b9709cd8ce176378f5bf317f22dd8ee4&aid=2230186&ucfs=1&arphpl=1&dest_id=835&dest_type=region&group_adults=2&req_adults=2&no_rooms=1&group_children=0&req_children=0&hpos=13&hapos=738&sr_order=popularity&srpvid=f0c23a7c639c0165&srepoch=1685175667&map_fdco=1&from=searchresults#hotelTmpl,Discovery Kartika Plaza Hotel,"Kartika Plaza, Kuta","Located next to Discovery Shopping Mall in South Kuta, Discovery Kartika Plaza Hotel features beachfront rooms surrounded by tropical gardens.",Cheap,8.1,Good,428
https://www.booking.com/hotel/id/astera-villa.html?sid=b9709cd8ce176378f5bf317f22dd8ee4&aid=2230186&ucfs=1&arphpl=1&dest_id=835&dest_type=region&group_adults=2&req_adults=2&no_rooms=1&group_children=0&req_children=0&hpos=14&hapos=739&sr_order=popularity&srpvid=f0c23a7c639c0165&srepoch=1685175667&from_sustainable_property_sr=1&map_fdco=1&from=searchresults#hotelTmpl,Astera Villa Seminyak by Ini Vie Hospitality,"Nakula, Seminyak","Located in the Nakula district of Seminyak, Astera Villa Seminyak by Ini Vie Hospitality has accommodations with a private pool and room service.",Expensive,8.3,Good,42
https://www.booking.com/hotel/id/zest-legian.html?sid=b9709cd8ce176378f5bf317f22dd8ee4&aid=2230186&ucfs=1&arphpl=1&dest_id=835&dest_type=region&group_adults=2&req_adults=2&no_rooms=1&group_children=0&req_children=0&hpos=15&hapos=740&sr_order=popularity&srpvid=f0c23a7c639c0165&srepoch=1685175667&from_sustainable_property_sr=1&map_fdco=1&from=searchresults#hotelTmpl,Zest Legian by Swiss-Belhotel International,"Padma, Legian","Set in Legian, 1312 feet from Double Six Beach, Zest Legian by Swiss-Belhotel International features a large swimming pool. It also features a restaurant and a bar.",Moderate,7.8,Good,214
https://www.booking.com/hotel/id/villa-boreh-beach-resort-and-spa.html?sid=b9709cd8ce176378f5bf317f22dd8ee4&aid=2230186&ucfs=1&arphpl=1&dest_id=835&dest_type=region&group_adults=2&req_adults=2&no_rooms=1&group_children=0&req_children=0&hpos=16&hapos=741&sr_order=popularity&srpvid=f0c23a7c639c0165&srepoch=1685175667&from_sustainable_property_sr=1&map_fdco=1&from=searchresults#hotelTmpl,Villa Boreh Beach Resort and Spa,Tejakula,"Located in the tranquil village of Sembiran in Bali's North East Coast, Villa Boreh Resort offers rustic accommodations with 2 outdoor swimming pools overlooking the garden or sea.",Expensive,9.4,Wonderful,16
https://www.booking.com/hotel/id/kampung-uma-dawa-resort-and-spa.html?sid=b9709cd8ce176378f5bf317f22dd8ee4&aid=2230186&ucfs=1&arphpl=1&dest_id=835&dest_type=region&group_adults=2&req_adults=2&no_rooms=1&group_children=0&req_children=0&hpos=17&hapos=742&sr_order=popularity&srpvid=f0c23a7c639c0165&srepoch=1685175667&from_sustainable_property_sr=1&map_fdco=1&from=searchresults#hotelTmpl,Kampung Uma Dawa Resort and Spa,Bedahulu,"Located 3.3 miles from Goa Gajah, Kampung Uma Dawa Resort and Spa offers an outdoor swimming pool, a garden and air-conditioned accommodations with a terrace and free WiFi.",Expensive,10,Exceptional,4
https://www.booking.com/hotel/id/swasti-eco-cottages-ubud.html?sid=b9709cd8ce176378f5bf317f22dd8ee4&aid=2230186&ucfs=1&arphpl=1&dest_id=835&dest_type=region&group_adults=2&req_adults=2&no_rooms=1&group_children=0&req_children=0&hpos=18&hapos=743&sr_order=popularity&srpvid=f0c23a7c639c0165&srepoch=1685175667&from_sustainable_property_sr=1&map_fdco=1&from=searchresults#hotelTmpl,Swasti Eco Cottages,Ubud,"Set in a lush tropical garden with an outdoor pool, Swasti Eco Cottages is an accommodations with a spa center and a sauna in Ubud.",Expensive,8.9,Exceptional,217
https://www.booking.com/hotel/id/suarapura-resort-amp-spa.html?sid=b9709cd8ce176378f5bf317f22dd8ee4&aid=2230186&ucfs=1&arphpl=1&dest_id=835&dest_type=region&group_adults=2&req_adults=2&no_rooms=1&group_children=0&req_children=0&hpos=19&hapos=744&sr_order=popularity&srpvid=f0c23a7c639c0165&srepoch=1685175667&from_sustainable_property_sr=1&map_fdco=1&from=searchresults#hotelTmpl,Suarapura Resort & Spa,Tegalalang,"Located in Desa Sebatu, a 3.7 mi drive to Tegallalang Rice Terraces, Suarapura Resort & Spa offers an infinity pool and a spa center.",Expensive,8.9,Exceptional,89
https://www.booking.com/hotel/id/khalisha-villa.html?sid=b9709cd8ce176378f5bf317f22dd8ee4&aid=2230186&ucfs=1&arphpl=1&dest_id=835&dest_type=region&group_adults=2&req_adults=2&no_rooms=1&group_children=0&req_children=0&hpos=20&hapos=745&sr_order=popularity&srpvid=f0c23a7c639c0165&srepoch=1685175667&map_fdco=1&from=searchresults#hotelTmpl,Khalisha Villa,Airsatang,"Located in Airsatang, Khalisha Villa has an outdoor swimming pool, garden and terrace. Featuring a restaurant, the property also has a shared lounge.",Expensive,8.2,Good,36
https://www.booking.com/hotel/id/villa-simone-new.html?sid=b9709cd8ce176378f5bf317f22dd8ee4&aid=2230186&ucfs=1&arphpl=1&dest_id=835&dest_type=region&group_adults=2&req_adults=2&no_rooms=1&group_children=0&req_children=0&hpos=21&hapos=746&sr_order=popularity&srpvid=f0c23a7c639c0165&srepoch=1685175667&map_fdco=1&from=searchresults#hotelTmpl,Villa Simone Bali,Ungasan,"Featuring an outdoor swimming pool, a garden, and a terrace, Villa Simone Bali provides accommodations in Ungasan with free WiFi and city views.",Moderate,8.9,Exceptional,34
https://www.booking.com/hotel/id/ling-amp-louies-mountain.html?sid=b9709cd8ce176378f5bf317f22dd8ee4&aid=2230186&ucfs=1&arphpl=1&dest_id=835&dest_type=region&group_adults=2&req_adults=2&no_rooms=1&group_children=0&req_children=0&hpos=22&hapos=747&sr_order=popularity&srpvid=f0c23a7c639c0165&srepoch=1685175667&from_sustainable_property_sr=1&map_fdco=1&from=searchresults#hotelTmpl,Ling & Louie's Mountain,Mayong,"Located in Mayong in the Bali region, Ling & Louie's Mountain has accommodations with free private parking.",Moderate,9.4,Wonderful,36
https://www.booking.com/hotel/id/jun-cottage.html?sid=b9709cd8ce176378f5bf317f22dd8ee4&aid=2230186&ucfs=1&arphpl=1&dest_id=835&dest_type=region&group_adults=2&req_adults=2&no_rooms=1&group_children=0&req_children=0&hpos=23&hapos=748&sr_order=popularity&srpvid=f0c23a7c639c0165&srepoch=1685175667&map_fdco=1&from=searchresults#hotelTmpl,JUN COTTAGE,Toyapakeh,"Located in Toyapakeh, within 7.7 miles of Seganing Waterfall and 8.8 miles of Angel's Billabong, JUN COTTAGE has accommodations with a garden and a terrace, and free WiFi.",Moderate,9.2,Wonderful,33
https://www.booking.com/hotel/id/alila-ubud.html?sid=b9709cd8ce176378f5bf317f22dd8ee4&aid=2230186&ucfs=1&arphpl=1&dest_id=835&dest_type=region&group_adults=2&req_adults=2&no_rooms=1&group_children=0&req_children=0&hpos=24&hapos=749&sr_order=popularity&srpvid=f0c23a7c639c0165&srepoch=1685175667&from_sustainable_property_sr=1&map_fdco=1&from=searchresults#hotelTmpl,Alila Ubud,Ubud,"This luxurious hillside retreat sits along the cooling banks of Ayung River in Bali, just 3.1 mi from popular Ubud. A relaxing holiday awaits with Alila Ubud's infinity pool and spa.",Expensive,8.1,Good,152
https://www.booking.com/hotel/id/h-ostel-bali.html?sid=b9709cd8ce176378f5bf317f22dd8ee4&aid=2230186&ucfs=1&arphpl=1&dest_id=835&dest_type=region&group_adults=2&req_adults=2&no_rooms=1&group_children=0&req_children=0&hpos=25&hapos=750&sr_order=popularity&srpvid=f0c23a7c639c0165&srepoch=1685175667&map_fdco=1&from=searchresults#hotelTmpl,H-ostel Bali,"Downtown Kuta, Kuta","Located only 328 feet from the vibrant Kuta Square, H-ostel Bali features an accommodations with sleek and modern design.",Moderate,7.9,Good,257
https://www.booking.com/hotel/id/papillon-echo-beach.html?sid=b9709cd8ce176378f5bf317f22dd8ee4&aid=2230186&ucfs=1&arphpl=1&dest_id=835&dest_type=region&group_adults=2&req_adults=2&no_rooms=1&group_children=0&req_children=0&hpos=2&hapos=752&sr_order=popularity&srpvid=f0c23a7c639c0165&srepoch=1685175669&from_sustainable_property_sr=1&map_fdco=1&from=searchresults#hotelTmpl,Papillon Echo Beach,"Batu Bolong, Canggu","Welcoming guests with modern accommodations and three outdoor pools, Papillon Echo Beach is located in the Canggu Beach district in Canggu. The villa is 656 feet from Echo Beach.",Moderate,7.9,Good,537
https://www.booking.com/hotel/id/surga-bali.html?sid=b9709cd8ce176378f5bf317f22dd8ee4&aid=2230186&ucfs=1&arphpl=1&dest_id=835&dest_type=region&group_adults=2&req_adults=2&no_rooms=1&group_children=0&req_children=0&hpos=3&hapos=753&sr_order=popularity&srpvid=f0c23a7c639c0165&srepoch=1685175669&from_sustainable_property_sr=1&map_fdco=1&from=searchresults#hotelTmpl,Uluwatu Cottages,"Padang Padang, Uluwatu","Uluwatu Cottages overlooks the sea and landscaped gardens atop a cliff in Uluwatu, just 5 minutes' drive from Padang Padang Beach.",Expensive,8.9,Exceptional,484
https://www.booking.com/hotel/id/harris-seminyak.html?sid=b9709cd8ce176378f5bf317f22dd8ee4&aid=2230186&ucfs=1&arphpl=1&dest_id=835&dest_type=region&group_adults=2&req_adults=2&no_rooms=1&group_children=0&req_children=0&hpos=4&hapos=754&sr_order=popularity&srpvid=f0c23a7c639c0165&srepoch=1685175669&from_sustainable_property_sr=1&map_fdco=1&from=searchresults#hotelTmpl,HARRIS Hotel Seminyak,"Drupadi, Seminyak","Located a 5-minute walk from Dhyana Pura Beach, brightly decorated HARRIS Hotel Seminyak offers an outdoor pool as well as free WiFi access throughout the property.",Moderate,7.7,Good,562
https://www.booking.com/hotel/id/pangkung-carik-villa-by-pramana.html?sid=b9709cd8ce176378f5bf317f22dd8ee4&aid=2230186&ucfs=1&arphpl=1&dest_id=835&dest_type=region&group_adults=2&req_adults=2&no_rooms=1&group_children=0&req_children=0&hpos=5&hapos=755&sr_order=popularity&srpvid=f0c23a7c639c0165&srepoch=1685175669&from_sustainable_property_sr=1&map_fdco=1&from=searchresults#hotelTmpl,Pangkung Carik Villa by Pramana,Blahbatu,"Featuring an outdoor pool, Pangkung Carik Villa by Pramana in Blahbatu has accommodations with free WiFi and free private parking for guests who drive.",Expensive,9.3,Wonderful,26
https://www.booking.com/hotel/id/song-lambung-beach-hut.html?sid=b9709cd8ce176378f5bf317f22dd8ee4&aid=2230186&ucfs=1&arphpl=1&dest_id=835&dest_type=region&group_adults=2&req_adults=2&no_rooms=1&group_children=0&req_children=0&hpos=6&hapos=756&sr_order=popularity&srpvid=f0c23a7c639c0165&srepoch=1685175669&from_sustainable_property_sr=1&map_fdco=1&from=searchresults#hotelTmpl,Song Lambung Beach Huts,"Mushroom Bay, Nusa Lembongan","Featuring an outdoor pool, garden and terrace, Song Lambung Beach Huts is located on the island of Lembongan. It includes free Wi-Fi, a waterfront restaurant and relaxing Balinese massages.",Expensive,8.6,Exceptional,240
https://www.booking.com/hotel/id/frangipani-beach.html?sid=b9709cd8ce176378f5bf317f22dd8ee4&aid=2230186&ucfs=1&arphpl=1&dest_id=835&dest_type=region&group_adults=2&req_adults=2&no_rooms=1&group_children=0&req_children=0&hpos=7&hapos=757&sr_order=popularity&srpvid=f0c23a7c639c0165&srepoch=1685175669&map_fdco=1&from=searchresults#hotelTmpl,Frangipani Beach Hotel,Lovina,"Located in Lovina, this beachfront hotel houses an outdoor pool and restaurant. Its rooms feature four-poster beds and a terrace with views of the garden, sea or paddy fields.",Cheap,8.5,Good,178
https://www.booking.com/hotel/id/jimbaran-bay-beach-resort-and-spa.html?sid=b9709cd8ce176378f5bf317f22dd8ee4&aid=2230186&ucfs=1&arphpl=1&dest_id=835&dest_type=region&group_adults=2&req_adults=2&no_rooms=1&group_children=0&req_children=0&hpos=8&hapos=758&sr_order=popularity&srpvid=f0c23a7c639c0165&srepoch=1685175669&from_sustainable_property_sr=1&map_fdco=1&from=searchresults#hotelTmpl,Jimbaran Bay Beach Resort and Spa by Prabhu,"Jimbaran Bay, Jimbaran",Jimbaran Bay Beach Resort and Spa offers accommodations featuring an outdoor pool with a swim-up bar. Guests can also enjoy cocktails at the rooftop bar overlooking the sea.,Moderate,7.5,Good,491
https://www.booking.com/hotel/id/ketut-s-place.html?sid=b9709cd8ce176378f5bf317f22dd8ee4&aid=2230186&ucfs=1&arphpl=1&dest_id=835&dest_type=region&group_adults=2&req_adults=2&no_rooms=1&group_children=0&req_children=0&hpos=9&hapos=759&sr_order=popularity&srpvid=f0c23a7c639c0165&srepoch=1685175669&from_sustainable_property_sr=1&map_fdco=1&from=searchresults#hotelTmpl,Ketut's Place Bed & Breakfast Ubud,Ubud,"Nestled within lush Balinese gardens, Ketut’s Place features an outdoor pool and cozy rooms with a private terrace or balcony. It also offers 24-hour room service and free Wi-Fi in all areas.",Moderate,8.6,Exceptional,331
https://www.booking.com/hotel/id/swiss-belhotel-rainforrest.html?sid=b9709cd8ce176378f5bf317f22dd8ee4&aid=2230186&ucfs=1&arphpl=1&dest_id=835&dest_type=region&group_adults=2&req_adults=2&no_rooms=1&group_children=0&req_children=0&hpos=10&hapos=760&sr_order=popularity&srpvid=f0c23a7c639c0165&srepoch=1685175669&map_fdco=1&from=searchresults#hotelTmpl,Swiss-Belhotel Rainforest,"Sunset Road, Kuta","Featuring an outdoor pool, on-site restaurant and a gym, the Swiss-Belhotel Rainforest has 4-star accommodations with free Wi-Fi and free parking.",Moderate,7.3,Good,80
https://www.booking.com/hotel/id/barong-villas-karangasem.html?sid=b9709cd8ce176378f5bf317f22dd8ee4&aid=2230186&ucfs=1&arphpl=1&dest_id=835&dest_type=region&group_adults=2&req_adults=2&no_rooms=1&group_children=0&req_children=0&hpos=11&hapos=761&sr_order=popularity&srpvid=f0c23a7c639c0165&srepoch=1685175669&map_fdco=1&from=searchresults#hotelTmpl,Barong Villas,Sidemen,"Featuring an outdoor swimming pool, a garden, and a shared lounge, Barong Villas has accommodations in Sidemen with free WiFi and mountain views.",Expensive,8.8,Exceptional,113
