source_href,name_hotel,region,description,price_label,rating,rating_type,review_count,location,formatted_address,formatted_region
https://www.booking.com/hotel/id/puri-sebali-resort.html?sid=b9709cd8ce176378f5bf317f22dd8ee4&aid=2230186&ucfs=1&arphpl=1&dest_id=835&dest_type=region&group_adults=2&req_adults=2&no_rooms=1&group_children=0&req_children=0&hpos=23&hapos=248&sr_order=popularity&srpvid=f0c23a7c639c0165&srepoch=1685175629&from_sustainable_property_sr=1&map_fdco=1&from=searchresults#hotelTmpl,Puri Sebali Resort,"Sambahan, Ubud","Boasting an outdoor swimming pools and free WiFi access throughout, Puri Sebali Resort provides a tranquil getaway in Ubud. It is located just a 15-minute drive from Ubud Market.",Moderate,9.3,Wonderful,241,"{'lat': -8.4708618, 'lng': 115.2581762}","Jl. Raya Sebali, Kelusa, Kecamatan Ubud, Kabupaten Gianyar, Bali 80571, Indonesia","Ubud, Gianyar"
https://www.booking.com/hotel/id/medewi-beach-inn.html?sid=b9709cd8ce176378f5bf317f22dd8ee4&aid=2230186&ucfs=1&arphpl=1&dest_id=835&dest_type=region&group_adults=2&req_adults=2&no_rooms=1&group_children=0&req_children=0&hpos=24&hapos=249&sr_order=popularity&srpvid=f0c23a7c639c0165&srepoch=1685175629&from_sustainable_property_sr=1&map_fdco=1&from=searchresults#hotelTmpl,Medewi Beach Inn,"Medewi, Pulukan","Located in Pulukan in the Bali Region, 6.2 mi from Rambut Siwi Temple, Medewi Beach Inn features a terrace and views of the garden. Guests can enjoy the on-site restaurant.",Cheap,8.8,Exceptional,43,"{'lat': -8.4187362, 'lng': 114.8064355}","Jl. Pantai Medewi, Medewi, Kec. Pekutatan, Kabupaten Jembrana, Bali 82262, Indonesia","Pekutatan, Jembrana"
https://www.booking.com/hotel/id/ubud-aura.html?sid=b9709cd8ce176378f5bf317f22dd8ee4&aid=2230186&ucfs=1&arphpl=1&dest_id=835&dest_type=region&group_adults=2&req_adults=2&no_rooms=1&group_children=0&req_children=0&hpos=25&hapos=250&sr_order=popularity&srpvid=f0c23a7c639c0165&srepoch=1685175629&from_sustainable_property_sr=1&map_fdco=1&from=searchresults#hotelTmpl,Ubud Aura Retreat,"Pengosekan, Ubud","Located in Ubud, a 9-minute walk from Ubud Monkey Forest, Ubud Aura Retreat provides accommodations with an outdoor swimming pool, free private parking, a garden and a terrace.",Moderate,9,Wonderful,271,"{'lat': -8.519067, 'lng': 115.2641504}","Jl. Hanoman No.888, Ubud, Kec. Gianyar, Kabupaten Gianyar, Bali 80571, Indonesia","Gianyar, Gianyar"
https://www.booking.com/hotel/id/jero-tumbuk-private-villa.html?sid=b9709cd8ce176378f5bf317f22dd8ee4&aid=2230186&ucfs=1&arphpl=1&dest_id=835&dest_type=region&group_adults=2&req_adults=2&no_rooms=1&group_children=0&req_children=0&hpos=2&hapos=252&sr_order=popularity&srpvid=f0c23a7c639c0165&srepoch=1685175631&from_sustainable_property_sr=1&map_fdco=1&from=searchresults#hotelTmpl,Jero Tumbuk Private Villa,Selat,"Providing mountain views, Jero Tumbuk Private Villa in Selat provides accommodations, an outdoor swimming pool, a garden, a shared lounge, a terrace and a restaurant.",Expensive,8.3,Good,12,"{'lat': -8.4376683, 'lng': 115.48426}","Baledan St, Selat, Karangasem Regency, Bali 80862, Indonesia","Selat, Karangasem"
https://www.booking.com/hotel/id/anumana-ubud.html?sid=b9709cd8ce176378f5bf317f22dd8ee4&aid=2230186&ucfs=1&arphpl=1&dest_id=835&dest_type=region&group_adults=2&req_adults=2&no_rooms=1&group_children=0&req_children=0&hpos=3&hapos=253&sr_order=popularity&srpvid=f0c23a7c639c0165&srepoch=1685175631&from_sustainable_property_sr=1&map_fdco=1&from=searchresults#hotelTmpl,Anumana Ubud Hotel,"Downtown Ubud, Ubud","Offering an outdoor pool and a restaurant, Anumana Ubud Hotel is less than a 5-minute walk from the sacred Monkey Forest. A 24-hour front desk and Free WiFi access are available.",Expensive,8.9,Exceptional,591,"{'lat': -8.5183574, 'lng': 115.2621539}","Jl. Monkey Forest, Ubud, Kecamatan Ubud, Kabupaten Gianyar, Bali 80571, Indonesia","Ubud, Gianyar"
https://www.booking.com/hotel/id/neano-escape.html?sid=b9709cd8ce176378f5bf317f22dd8ee4&aid=2230186&ucfs=1&arphpl=1&dest_id=835&dest_type=region&group_adults=2&req_adults=2&no_rooms=1&group_children=0&req_children=0&hpos=4&hapos=254&sr_order=popularity&srpvid=f0c23a7c639c0165&srepoch=1685175631&map_fdco=1&from=searchresults#hotelTmpl,NEANO ESCAPE,Manggis,"Located in Manggis, a 16-minute walk from Buitan Beach, NEANO ESCAPE has accommodations with an outdoor swimming pool, free private parking, a fitness center and a garden.",Expensive,9.5,Exceptional,533,"{'lat': -8.4909734, 'lng': 115.5343435}","Jalan Bukit Meluang Desa Adat Apit Yeh, Manggis, Kec. Manggis, Kabupaten Karangasem, Bali 80871, Indonesia","Manggis, Karangasem"
https://www.booking.com/hotel/id/amnaya-resort-kuta.html?sid=b9709cd8ce176378f5bf317f22dd8ee4&aid=2230186&ucfs=1&arphpl=1&dest_id=835&dest_type=region&group_adults=2&req_adults=2&no_rooms=1&group_children=0&req_children=0&hpos=5&hapos=255&sr_order=popularity&srpvid=f0c23a7c639c0165&srepoch=1685175631&from_sustainable_property_sr=1&map_fdco=1&from=searchresults#hotelTmpl,Amnaya Resort Kuta,"Kartika Plaza, Kuta","Boasting an à la carte restaurant, Amnaya Resort Kuta provides comfortable accommodations with free in-room WiFi access in Kuta.",Expensive,9.1,Wonderful,2746,"{'lat': -8.7299278, 'lng': 115.1700662}","Jl. Kartika Plaza Gg. Puspa Ayu No.99, Kuta, Kec. Kuta, Kabupaten Badung, Bali 80361, Indonesia","Kuta, Badung"
https://www.booking.com/hotel/id/intercontinental-bali-resort.html?sid=b9709cd8ce176378f5bf317f22dd8ee4&aid=2230186&ucfs=1&arphpl=1&dest_id=835&dest_type=region&group_adults=2&req_adults=2&no_rooms=1&group_children=0&req_children=0&hpos=6&hapos=256&sr_order=popularity&srpvid=f0c23a7c639c0165&srepoch=1685175631&from_sustainable_property_sr=1&map_fdco=1&from=searchresults#hotelTmpl,"InterContinental Bali Resort, an IHG Hotel","Jimbaran Bay, Jimbaran","InterContinental Bali Resort is located along Jimbaran Bay, just 15 minutes’ drive from Ngurah Rai International Airport. It features 6 pools and a 24-hour fitness center.",Expensive,8.8,Exceptional,472,"{'lat': -8.7796489, 'lng': 115.1676792}","Uluwatu St No.45, Jimbaran, Bali, Badung Regency, Bali 80361, Indonesia","Kuta Selatan, Badung"
https://www.booking.com/hotel/id/the-kumpi-bali-by-the-lavana.html?sid=b9709cd8ce176378f5bf317f22dd8ee4&aid=2230186&ucfs=1&arphpl=1&dest_id=835&dest_type=region&group_adults=2&req_adults=2&no_rooms=1&group_children=0&req_children=0&hpos=7&hapos=257&sr_order=popularity&srpvid=f0c23a7c639c0165&srepoch=1685175631&map_fdco=1&from=searchresults#hotelTmpl,The Kumpi Bali by The Lavana,Tumbak Bayuh,"Located in Tumbak Bayuh, 5.1 miles from Tanah Lot Temple, The Kumpi Bali by The Lavana has accommodations with an outdoor swimming pool, free private parking and a garden.",Expensive,8.8,Exceptional,17,"{'lat': -8.6341468, 'lng': 115.1401164}","Jl. Raya Tiyingtutul No.6, Pererenan, Kab, Kabupaten Badung, Bali 80361, Indonesia","Mengwi, badung"
https://www.booking.com/hotel/id/munduk-jaen-bali-retreat-by-madhava.html?sid=b9709cd8ce176378f5bf317f22dd8ee4&aid=2230186&ucfs=1&arphpl=1&dest_id=835&dest_type=region&group_adults=2&req_adults=2&no_rooms=1&group_children=0&req_children=0&hpos=8&hapos=258&sr_order=popularity&srpvid=f0c23a7c639c0165&srepoch=1685175631&from_sustainable_property_sr=1&map_fdco=1&from=searchresults#hotelTmpl,Amarta Pesagi Retreat,Tabanan,"Located in Tabanan, Amarta Pesagi Retreat provides free WiFi, and guests can enjoy a garden, a terrace and a restaurant. An Asian breakfast is available daily at the villa.",Cheap,8.5,Good,40,"{'lat': -8.4453452, 'lng': 115.0915762}","Munduk Juwet, Pesagi, Kec. Penebel, Kabupaten Tabanan, Bali 82152, Indonesia","Penebel, Tabanan"
https://www.booking.com/hotel/id/pondok-bali-kabupaten-bangli.html?sid=b9709cd8ce176378f5bf317f22dd8ee4&aid=2230186&ucfs=1&arphpl=1&dest_id=835&dest_type=region&group_adults=2&req_adults=2&no_rooms=1&group_children=0&req_children=0&hpos=9&hapos=259&sr_order=popularity&srpvid=f0c23a7c639c0165&srepoch=1685175631&from_sustainable_property_sr=1&map_fdco=1&from=searchresults#hotelTmpl,Bali Cottages Lake View,Kintamani,"Located in Kintamani, within 22 miles of Tegallalang Rice Terrace and 28 miles of Neka Art Museum, Bali Cottages Lake View provides accommodations with a terrace as well as free private parking for...",Cheap,9.1,Wonderful,210,"{'lat': -8.2228889, 'lng': 115.3983505}","Jl. Bun Bulan No.03, Songan A, Kec. Kintamani, Kabupaten Bangli, Bali 80562, Indonesia","Kintamani, Bangli"
https://www.booking.com/hotel/id/swar-bali-resort.html?sid=b9709cd8ce176378f5bf317f22dd8ee4&aid=2230186&ucfs=1&arphpl=1&dest_id=835&dest_type=region&group_adults=2&req_adults=2&no_rooms=1&group_children=0&req_children=0&hpos=10&hapos=260&sr_order=popularity&srpvid=f0c23a7c639c0165&srepoch=1685175631&from_sustainable_property_sr=1&map_fdco=1&from=searchresults#hotelTmpl,Swar Bali Lodge,Munduk,"5 mi from Banyumala Waterfall, Swar Bali Lodge is set in Munduk and features rooms with free WiFi. The property provides mountain views. All units are equipped with a flat-screen TV.",Expensive,8.1,Good,139,"{'lat': -8.2635218, 'lng': 115.0444411}","Banjar Tabog, Jl. Kayu Putih - Munduk, Banyuasri, Kec. Buleleng, Kabupaten Buleleng, Bali 81161, Indonesia","Buleleng, Buleleng"
https://www.booking.com/hotel/id/beach-house-west-bali.html?sid=b9709cd8ce176378f5bf317f22dd8ee4&aid=2230186&ucfs=1&arphpl=1&dest_id=835&dest_type=region&group_adults=2&req_adults=2&no_rooms=1&group_children=0&req_children=0&hpos=11&hapos=261&sr_order=popularity&srpvid=f0c23a7c639c0165&srepoch=1685175631&from_sustainable_property_sr=1&map_fdco=1&from=searchresults#hotelTmpl,Paradise West-Bali,Palasari,"Located a few steps from Melaya Beach, Paradise West-Bali offers an outdoor swimming pool, a garden and air-conditioned accommodations with a terrace and free WiFi.",Cheap,9.3,Wonderful,11,"{'lat': -8.2603999, 'lng': 114.4775687}","PFQH+R2C, Jl. Ikan Paus, Sumbersari, Kec. Melaya, Kabupaten Jembrana, Bali 82252, Indonesia","Melaya, Jembrana"
https://www.booking.com/hotel/id/karana-resort-ubud.html?sid=b9709cd8ce176378f5bf317f22dd8ee4&aid=2230186&ucfs=1&arphpl=1&dest_id=835&dest_type=region&group_adults=2&req_adults=2&no_rooms=1&group_children=0&req_children=0&hpos=12&hapos=262&sr_order=popularity&srpvid=f0c23a7c639c0165&srepoch=1685175631&map_fdco=1&from=searchresults#hotelTmpl,Freddies Villas Ubud Bali,Sukawati,"Set in Lot Tunduh in the south of Ubud, 1 mi from Bali Zoo, Karana Ubud provides air-conditioned rooms with free WiFi. The property has a bar, as well as a restaurant serving local cuisine.",Moderate,7.7,Good,37,"{'lat': -8.5784988, 'lng': 115.2650897}","Jalan Gunung Abang, Banjar, Penataran, Lodtunduh, Kecamatan Ubud, Kabupaten Gianyar, Bali 80423, Indonesia","Ubud, Gianyar"
https://www.booking.com/hotel/id/ananda-singaraja.html?sid=b9709cd8ce176378f5bf317f22dd8ee4&aid=2230186&ucfs=1&arphpl=1&dest_id=835&dest_type=region&group_adults=2&req_adults=2&no_rooms=1&group_children=0&req_children=0&hpos=13&hapos=263&sr_order=popularity&srpvid=f0c23a7c639c0165&srepoch=1685175631&from_sustainable_property_sr=1&map_fdco=1&from=searchresults#hotelTmpl,Ananda Homestay,Singaraja,"Offering river views, Ananda Homestay in Singaraja has accommodations and a garden. Free WiFi is offered.",Expensive,9.2,Wonderful,82,"{'lat': 29.8516871, 'lng': 79.60588410000001}","Jl. Poh Santog, Lemukih, Kec. Sawan, Kabupaten Buleleng, Bali 81171","Sawan, Buleleng"
https://www.booking.com/hotel/id/coco-garden.html?sid=b9709cd8ce176378f5bf317f22dd8ee4&aid=2230186&ucfs=1&arphpl=1&dest_id=835&dest_type=region&group_adults=2&req_adults=2&no_rooms=1&group_children=0&req_children=0&hpos=14&hapos=264&sr_order=popularity&srpvid=f0c23a7c639c0165&srepoch=1685175631&map_fdco=1&from=searchresults#hotelTmpl,Coco Garden,Kubutambahan,"Located in Air Sanih Village, 30 mi from Ubud, Coco Garden features air-conditioned rooms with free WiFi throughout the property. Some units feature a seating area where you can relax.",Expensive,8.9,Exceptional,54,"{'lat': (None) , 'lng': (None)}","W68C+Q89, Jl. Majapahit, Kubutambahan, Kec. Kubutambahan, Kabupaten Buleleng, Bali 81171","Kubutambahan, Buleleng"
https://www.booking.com/hotel/id/sampatti-villas-seminyak.html?sid=b9709cd8ce176378f5bf317f22dd8ee4&aid=2230186&ucfs=1&arphpl=1&dest_id=835&dest_type=region&group_adults=2&req_adults=2&no_rooms=1&group_children=0&req_children=0&hpos=15&hapos=265&sr_order=popularity&srpvid=f0c23a7c639c0165&srepoch=1685175631&from_sustainable_property_sr=1&map_fdco=1&from=searchresults#hotelTmpl,Sampatti Villas,"Sunset Road, Seminyak","Located in Seminyak, 1.8 miles from Double Six Beach, Sampatti Villas provides accommodations with a garden, free private parking, a terrace and a restaurant.",Cheap,9.2,Wonderful,276,"{'lat': -8.6918353, 'lng': 115.1748793}","Jl. Dewi Sita Selatan No.88, Seminyak, Kec. Kuta, Kabupaten Badung, Bali 80361, Indonesia","Kuta, Badung"
https://www.booking.com/hotel/id/alamdhari-resort-and-spa.html?sid=b9709cd8ce176378f5bf317f22dd8ee4&aid=2230186&ucfs=1&arphpl=1&dest_id=835&dest_type=region&group_adults=2&req_adults=2&no_rooms=1&group_children=0&req_children=0&hpos=16&hapos=266&sr_order=popularity&srpvid=f0c23a7c639c0165&srepoch=1685175631&from_sustainable_property_sr=1&map_fdco=1&from=searchresults#hotelTmpl,Alamdhari Resort and Spa,Sidemen,"Located in Sidemen, 19 miles from Goa Gajah, Alamdhari Resort and Spa provides accommodations with an outdoor swimming pool, free private parking, a garden and a terrace.",Expensive,8.8,Exceptional,248,"{'lat': -8.472798599999999, 'lng': 115.4414299}","Br. Dinas, Jl. Raya Tebola, Telaga Tawang, Kec. Sidemen, Kabupaten Karangasem, Bali 80864, Indonesia","Sidemen, Karangasem"
https://www.booking.com/hotel/id/sentulan-garden.html?sid=b9709cd8ce176378f5bf317f22dd8ee4&aid=2230186&ucfs=1&arphpl=1&dest_id=835&dest_type=region&group_adults=2&req_adults=2&no_rooms=1&group_children=0&req_children=0&hpos=17&hapos=267&sr_order=popularity&srpvid=f0c23a7c639c0165&srepoch=1685175631&from_sustainable_property_sr=1&map_fdco=1&from=searchresults#hotelTmpl,Sentulan Garden,Nusa Penida,"Located just 1.8 miles from Kelingking Beach in Nusa Penida, Sentulan Garden has a getaway with a garden, outdoor pool, free WiFi, and room service.",Expensive,8.5,Good,175,"{'lat': -8.746304199999999, 'lng': 115.4913202}","Bunga Mekar, Nusa Penida, Klungkung Regency, Bali 80771, Indonesia","Nusa Penida, Klungkung"
https://www.booking.com/hotel/id/bali-bening.html?sid=b9709cd8ce176378f5bf317f22dd8ee4&aid=2230186&ucfs=1&arphpl=1&dest_id=835&dest_type=region&group_adults=2&req_adults=2&no_rooms=1&group_children=0&req_children=0&hpos=18&hapos=268&sr_order=popularity&srpvid=f0c23a7c639c0165&srepoch=1685175631&map_fdco=1&from=searchresults#hotelTmpl,Bali Bening,Munduk,"Bali Bening is offering accommodations in Munduk. There's a restaurant serving American cuisine, and free private parking is available.",Expensive,9.3,Wonderful,132,"{'lat': -8.2665521, 'lng': 115.0630785}","P3M7+96G, Jl. Batugalih, Munduk, Kec. Banjar, Kabupaten Buleleng, Bali 81152, Indonesia","Banjar, Buleleng"
https://www.booking.com/hotel/id/grandmas.html?sid=b9709cd8ce176378f5bf317f22dd8ee4&aid=2230186&ucfs=1&arphpl=1&dest_id=835&dest_type=region&group_adults=2&req_adults=2&no_rooms=1&group_children=0&req_children=0&hpos=19&hapos=269&sr_order=popularity&srpvid=f0c23a7c639c0165&srepoch=1685175631&from_sustainable_property_sr=1&map_fdco=1&from=searchresults#hotelTmpl,Grandmas Plus Hotel Seminyak,"Dyanapura, Seminyak","Just a 2-minute walk from Seminyak Beach, Grandmas Seminyak Hotel offers modern rooms with free WiFi access and flat-screen cable TVs.",Expensive,8.5,Good,2480,"{'lat': -8.6921587, 'lng': 115.1615759}","Jl. Camplung Tanduk No.99, Seminyak, Kec. Kuta, Kabupaten Badung, Bali 80361, Indonesia","Kuta, Badung"
https://www.booking.com/hotel/id/inaya-putri-bali-nusadua.html?sid=b9709cd8ce176378f5bf317f22dd8ee4&aid=2230186&ucfs=1&arphpl=1&dest_id=835&dest_type=region&group_adults=2&req_adults=2&no_rooms=1&group_children=0&req_children=0&hpos=20&hapos=270&sr_order=popularity&srpvid=f0c23a7c639c0165&srepoch=1685175631&from_sustainable_property_sr=1&map_fdco=1&from=searchresults#hotelTmpl,MERUSAKA Nusa Dua,"BTDC, Nusa Dua","Located along the beachfront Nusa Dua, a 15-minute walk from Bali Collection, MERUSAKA Nusa Dua offers modern and elegant accommodations with free in-room WiFi access. It features an outdoor pool.",Expensive,8.4,Good,1300,"{'lat': -8.8068973, 'lng': 115.2294092}","Kawasan Wisata Nusa Dua Lot S-3, Benoa, Kec. Kuta Sel., Kabupaten Badung, Bali 80363, Indonesia","Kuta Selatan, Badung"
https://www.booking.com/hotel/id/khaiyyara-jimbaran-bali.html?sid=b9709cd8ce176378f5bf317f22dd8ee4&aid=2230186&ucfs=1&arphpl=1&dest_id=835&dest_type=region&group_adults=2&req_adults=2&no_rooms=1&group_children=0&req_children=0&hpos=21&hapos=271&sr_order=popularity&srpvid=f0c23a7c639c0165&srepoch=1685175631&map_fdco=1&from=searchresults#hotelTmpl,Khaiyyara Jimbaran Bali,Badung,"Khaiyyara Jimbaran Bali features an outdoor swimming pool, terrace, a restaurant and bar in Badung. This 4-star hotel offers room service and a 24-hour front desk.",Expensive,8.4,Good,71,"{'lat': -8.8237914, 'lng': 115.143829}","Jl. Batu Nunggul No.8, Ungasan, Kec. Kuta Sel., Kabupaten Badung, Bali 80361, Indonesia","Kuta Selatan, Badung"
https://www.booking.com/hotel/id/bali-bobo.html?sid=b9709cd8ce176378f5bf317f22dd8ee4&aid=2230186&ucfs=1&arphpl=1&dest_id=835&dest_type=region&group_adults=2&req_adults=2&no_rooms=1&group_children=0&req_children=0&hpos=22&hapos=272&sr_order=popularity&srpvid=f0c23a7c639c0165&srepoch=1685175631&map_fdco=1&from=searchresults#hotelTmpl,Bali Bobo Hostel,"Bukit, Jimbaran","Located in Jimbaran, 2.3 miles from Samasta Lifestyle Village, Bali Bobo Hostel provides accommodations with an outdoor swimming pool, free private parking, a garden and a shared lounge.",Expensive,9.6,Exceptional,284,"{'lat': -8.7884922, 'lng': 115.1798191}","Jl. Panorama Jimbaran, Jimbaran, Kec. Kuta Sel., Kabupaten Badung, Bali 80361, Indonesia","Kuta Selatan, Badung"
https://www.booking.com/hotel/id/adiwana-resort-jembawan.html?sid=b9709cd8ce176378f5bf317f22dd8ee4&aid=2230186&ucfs=1&arphpl=1&dest_id=835&dest_type=region&group_adults=2&req_adults=2&no_rooms=1&group_children=0&req_children=0&hpos=23&hapos=273&sr_order=popularity&srpvid=f0c23a7c639c0165&srepoch=1685175631&from_sustainable_property_sr=1&map_fdco=1&from=searchresults#hotelTmpl,Adiwana Resort Jembawan,"Downtown Ubud, Ubud","Set among tropical greenery in Ubud, Bali, Adiwana Resort Jembawan features an outdoor pool, a spa center and yoga facilities.",Cheap,9,Wonderful,660,"{'lat': -8.509909, 'lng': 115.2668648}","Jl. Jembawan, Ubud, Kecamatan Ubud, Kabupaten Gianyar, Bali 80571, Indonesia","Ubud, Gianyar"
https://www.booking.com/hotel/id/amnaya-resort-nusa-dua.html?sid=b9709cd8ce176378f5bf317f22dd8ee4&aid=2230186&ucfs=1&arphpl=1&dest_id=835&dest_type=region&group_adults=2&req_adults=2&no_rooms=1&group_children=0&req_children=0&hpos=24&hapos=274&sr_order=popularity&srpvid=f0c23a7c639c0165&srepoch=1685175631&from_sustainable_property_sr=1&map_fdco=1&from=searchresults#hotelTmpl,Amnaya Resort Nusa Dua,"Tanjung Benoa, Nusa Dua","Amnaya Resort Nusa Dua features an outdoor swimming pool, garden, a restaurant and bar in Nusa Dua. This 4-star hotel offers a concierge service and a tour desk.",Cheap,9.3,Wonderful,1064,"{'lat': -8.7704486, 'lng': 115.2220281}","Jl. Pratama No.87, Tj. Benoa, Kec. Kuta Sel., Kabupaten Badung, Bali 80363, Indonesia","Kuta Selatan, Badung"
https://www.booking.com/hotel/id/le-48-zen.html?sid=b9709cd8ce176378f5bf317f22dd8ee4&aid=2230186&ucfs=1&arphpl=1&dest_id=835&dest_type=region&group_adults=2&req_adults=2&no_rooms=1&group_children=0&req_children=0&hpos=25&hapos=275&sr_order=popularity&srpvid=f0c23a7c639c0165&srepoch=1685175631&from_sustainable_property_sr=1&map_fdco=1&from=searchresults#hotelTmpl,The Forty Eight Resort Candidasa,Candidasa,"Offering air-conditioned cottages centered-around a pool, and surrounded by Eastern Bali peaceful greenery, The Forty Eight Resort Candidasa is just 164 feet from the ocean.",Expensive,8.5,Good,320,"{'lat': -8.5108157, 'lng': 115.5731963}","Jl. Raya Candidasa No.48, Sengkidu, Kec. Karangasem, Kabupaten Karangasem, Bali 80851, Indonesia","Karangasem, Karangasem"
https://www.booking.com/hotel/id/b-bali.html?sid=b9709cd8ce176378f5bf317f22dd8ee4&aid=2230186&ucfs=1&arphpl=1&dest_id=835&dest_type=region&group_adults=2&req_adults=2&no_rooms=1&group_children=0&req_children=0&hpos=2&hapos=277&sr_order=popularity&srpvid=f0c23a7c639c0165&srepoch=1685175633&from_sustainable_property_sr=1&map_fdco=1&from=searchresults#hotelTmpl,b Hotel Bali & Spa,"Imam Bonjol, Denpasar","A 10-minute drive from Kuta Beach, b Hotel Bali is a contemporary minimalist-style hotel with a spa, and an outdoor pool. Free Wi-Fi throughout its premises.",Moderate,7.9,Good,359,"{'lat': -8.7035625, 'lng': 115.184132}","Jl. Imam Bonjol No.508, Pemecutan Klod, Kec. Denpasar Bar., Kota Denpasar, Bali 80119, Indonesia","Denpasar Barat, Denpasar"
https://www.booking.com/hotel/id/bali-relaxing-resort-and-spa.html?sid=b9709cd8ce176378f5bf317f22dd8ee4&aid=2230186&ucfs=1&arphpl=1&dest_id=835&dest_type=region&group_adults=2&req_adults=2&no_rooms=1&group_children=0&req_children=0&hpos=3&hapos=278&sr_order=popularity&srpvid=f0c23a7c639c0165&srepoch=1685175633&from_sustainable_property_sr=1&map_fdco=1&from=searchresults#hotelTmpl,Bali Relaxing Resort and Spa,"Tanjung Benoa, Nusa Dua",Located along Nusa Dua Beach Bali Relaxing Resort and Spa houses an outdoor swimming pool and 2 dining options. This beachfront property offers free drop-off to Tanjung Benoa and Nusa Dua areas.,Moderate,7.9,Good,801,"{'lat': (None) , 'lng': (None)}","Jl. Pratama No.62, Benoa, Kec. Kuta Sel., Kabupaten Badung, Bali 80361","Kuta Selatan, Badung"
https://www.booking.com/hotel/id/bobocabin-kintamani.html?sid=b9709cd8ce176378f5bf317f22dd8ee4&aid=2230186&ucfs=1&arphpl=1&dest_id=835&dest_type=region&group_adults=2&req_adults=2&no_rooms=1&group_children=0&req_children=0&hpos=4&hapos=279&sr_order=popularity&srpvid=f0c23a7c639c0165&srepoch=1685175633&map_fdco=1&from=searchresults#hotelTmpl,Bobocabin Kintamani,Kintamani,"Featuring 4-star accommodations, Bobocabin Kintamani is located in Kintamani, 20 miles from Tegallalang Rice Terrace and 26 miles from Goa Gajah.",Moderate,7.7,Good,96,"{'lat': -8.2354374, 'lng': 115.4002554}","Jl. Mundukan Ngandang Jl. Song Dikit, Songan A, Kec. Kintamani, Kabupaten Bangli, Bali 80652, Indonesia","Kintamani, Bangli"
https://www.booking.com/hotel/id/om-ham-retreat-ubud.html?sid=b9709cd8ce176378f5bf317f22dd8ee4&aid=2230186&ucfs=1&arphpl=1&dest_id=835&dest_type=region&group_adults=2&req_adults=2&no_rooms=1&group_children=0&req_children=0&hpos=5&hapos=280&sr_order=popularity&srpvid=f0c23a7c639c0165&srepoch=1685175633&from_sustainable_property_sr=1&map_fdco=1&from=searchresults#hotelTmpl,Om Ham Retreat and Resort,"Taman, Ubud","Strategically located just a 10-minute from Ubud Market and Ubud Royal Palace, Om Ham Retreat and Resort offers an outdoor swimming pool, free WiFi access in all areas of the property and free on-site...",Expensive,8.8,Exceptional,338,"{'lat': -8.468229899999999, 'lng': 115.2713095}","Tirta Tawar Road, Banjar Junjungan, Ubud, Kecamatan Ubud, Kabupaten Gianyar, Bali 80571, Indonesia","Ubud, Gianyar"
https://www.booking.com/hotel/id/tjampuhan-spa.html?sid=b9709cd8ce176378f5bf317f22dd8ee4&aid=2230186&ucfs=1&arphpl=1&dest_id=835&dest_type=region&group_adults=2&req_adults=2&no_rooms=1&group_children=0&req_children=0&hpos=6&hapos=281&sr_order=popularity&srpvid=f0c23a7c639c0165&srepoch=1685175633&map_fdco=1&from=searchresults#hotelTmpl,Hotel Tjampuhan Spa,"Sayan, Ubud","Hotel Tjampuhan Spa is located in Bali’s Ubud Area, overlooking Gunung Lembah Temple and Rivers Oos and Tjampuhan.",Cheap,8,Good,269,"{'lat': -8.503692599999999, 'lng': 115.2532662}","Jl. Raya Campuhan, Ubud, Kecamatan Ubud, Kabupaten Gianyar, Bali 80571, Indonesia","Ubud, Gianyar"
https://www.booking.com/hotel/id/queen-at-gunung-sari.html?sid=b9709cd8ce176378f5bf317f22dd8ee4&aid=2230186&ucfs=1&arphpl=1&dest_id=835&dest_type=region&group_adults=2&req_adults=2&no_rooms=1&group_children=0&req_children=0&hpos=7&hapos=282&sr_order=popularity&srpvid=f0c23a7c639c0165&srepoch=1685175633&from_sustainable_property_sr=1&map_fdco=1&from=searchresults#hotelTmpl,Queen at Gunung Sari,Ubud,"Located a 17-minute walk from Ubud Palace, Queen at Gunung Sari offers 3-star accommodations in Ubud and features a garden.",Moderate,9,Wonderful,336,"{'lat': -8.507530299999999, 'lng': 115.2732155}","Jl. Pura Gn. Sari, Peliatan, Kecamatan Ubud, Kabupaten Gianyar, Bali 80571, Indonesia","Ubud, Gianyar"
https://www.booking.com/hotel/id/villa-pelangi-sidemen.html?sid=b9709cd8ce176378f5bf317f22dd8ee4&aid=2230186&ucfs=1&arphpl=1&dest_id=835&dest_type=region&group_adults=2&req_adults=2&no_rooms=1&group_children=0&req_children=0&hpos=8&hapos=283&sr_order=popularity&srpvid=f0c23a7c639c0165&srepoch=1685175633&from_sustainable_property_sr=1&map_fdco=1&from=searchresults#hotelTmpl,Pelangi Villas Sidemen,Sidemen,"In the heart of the Balinese countryside, with views of the mountains and gardens, Villa Pelangi Sideman offers an outdoor pool and villas with private terraces.",Expensive,8.9,Exceptional,213,"{'lat': -8.4743923, 'lng': 115.4435401}","Banjar Dinas, Jl. Raya Tebola, Telaga Tawang, Kec. Sidemen, Kabupaten Karangasem, Bali 80864, Indonesia","Sidemen, Karangasem"
