source_href,name_hotel,region,description,price_label,rating,rating_type,review_count,location,formatted_address,formatted_region
https://www.booking.com/hotel/id/bebek-cottages-sanur.html?sid=b9709cd8ce176378f5bf317f22dd8ee4&aid=2230186&ucfs=1&arphpl=1&dest_id=835&dest_type=region&group_adults=2&req_adults=2&no_rooms=1&group_children=0&req_children=0&hpos=24&hapos=499&sr_order=popularity&srpvid=f0c23a7c639c0165&srepoch=1685175648&map_fdco=1&from=searchresults#hotelTmpl,Bebek Cottages Sanur,"Sanur Beach, Sanur","Bebek Cottages Sanur has an outdoor swimming pool, garden, a terrace and restaurant in Sanur.",Expensive,9.1,Wonderful,190,"{'lat': -8.7088474, 'lng': 115.2486563}","Jl. Pengembak No.9, Sanur Kauh, Denpasar Selatan, Kota Denpasar, Bali, Indonesia","Denpasar Selatan, Denpasar"
https://www.booking.com/hotel/id/surya-chandra-beach-bungalow.html?sid=b9709cd8ce176378f5bf317f22dd8ee4&aid=2230186&ucfs=1&arphpl=1&dest_id=835&dest_type=region&group_adults=2&req_adults=2&no_rooms=1&group_children=0&req_children=0&hpos=25&hapos=500&sr_order=popularity&srpvid=f0c23a7c639c0165&srepoch=1685175648&from_sustainable_property_sr=1&map_fdco=1&from=searchresults#hotelTmpl,Surya Chandra Beach Bungalow,Nusa Penida,"Featuring a year-round outdoor pool, Surya Chandra Beach Bungalow in Nusa Penida provides accommodations with free WiFi and free private parking for guests who drive.",Expensive,8.6,Exceptional,171,"{'lat': -8.6828524, 'lng': 115.5758375}","8H8G+V85, Batununggul, Nusa Penida, Klungkung Regency, Bali 80771, Indonesia","Nusa Penida, Klungkung"
https://www.booking.com/hotel/id/pondok-tamiu.html?sid=b9709cd8ce176378f5bf317f22dd8ee4&aid=2230186&ucfs=1&arphpl=1&dest_id=835&dest_type=region&group_adults=2&req_adults=2&no_rooms=1&group_children=0&req_children=0&hpos=2&hapos=502&sr_order=popularity&srpvid=f0c23a7c639c0165&srepoch=1685175650&map_fdco=1&from=searchresults#hotelTmpl,Pondok Tamiu,"Downtown Ubud, Ubud","Well set in the center of Ubud, Pondok Tamiu provides air-conditioned rooms, an outdoor swimming pool, free WiFi and a garden.",Cheap,8.9,Exceptional,98,"{'lat': -8.5102951, 'lng': 115.258674}","Jl. Bisma No.46, Ubud, Kecamatan Ubud, Kabupaten Gianyar, Bali 80571, Indonesia","Ubud, Gianyar"
https://www.booking.com/hotel/id/bliss-ubud-abangan.html?sid=b9709cd8ce176378f5bf317f22dd8ee4&aid=2230186&ucfs=1&arphpl=1&dest_id=835&dest_type=region&group_adults=2&req_adults=2&no_rooms=1&group_children=0&req_children=0&hpos=3&hapos=503&sr_order=popularity&srpvid=f0c23a7c639c0165&srepoch=1685175650&from_sustainable_property_sr=1&map_fdco=1&from=searchresults#hotelTmpl,Bliss Ubud Abangan,"Downtown Ubud, Ubud","Located 500 yards from the center of Ubud, a 6-minute walk from Saraswati Temple, Bliss Ubud Abangan has air-conditioned accommodations with a terrace, an outdoor swimming pool and a garden.",Expensive,8.7,Exceptional,372,"{'lat': -8.5062765, 'lng': 115.2581658}","F7V5+F7X, Jalan Raya, Ubud, Gianyar Regency, Bali 80571, Indonesia","Ubud, Gianyar"
https://www.booking.com/hotel/id/galalima-glamping.html?sid=b9709cd8ce176378f5bf317f22dd8ee4&aid=2230186&ucfs=1&arphpl=1&dest_id=835&dest_type=region&group_adults=2&req_adults=2&no_rooms=1&group_children=0&req_children=0&hpos=4&hapos=504&sr_order=popularity&srpvid=f0c23a7c639c0165&srepoch=1685175650&from_sustainable_property_sr=1&map_fdco=1&from=searchresults#hotelTmpl,Galalima Glamping,Meliling,"Offering garden views, Galalima Glamping in Meliling has accommodations, an outdoor swimming pool, a garden, a terrace and a restaurant. Complimentary WiFi is offered throughout the property.",Cheap,8.9,Exceptional,17,"{'lat': -8.4625968, 'lng': 115.0683475}","Jl. Apityeh, Gn. Salak, Kec. Selemadeg Tim., Kabupaten Tabanan, Bali 82162, Indonesia","Selemadeg Timur, Tabanan"
https://www.booking.com/hotel/id/senetan-villas-amp-spa-resort.html?sid=b9709cd8ce176378f5bf317f22dd8ee4&aid=2230186&ucfs=1&arphpl=1&dest_id=835&dest_type=region&group_adults=2&req_adults=2&no_rooms=1&group_children=0&req_children=0&hpos=5&hapos=505&sr_order=popularity&srpvid=f0c23a7c639c0165&srepoch=1685175650&from_sustainable_property_sr=1&map_fdco=1&from=searchresults#hotelTmpl,Senetan Villas and Spa Resort,Payangan,"Located in the tranquil area of Ubud, Senetan Villas and Spa Resort offers a wonderful retreat villa featuring private outdoor swimming pool and free WiFi access.",Cheap,8.6,Exceptional,76,"{'lat': -8.3727511, 'lng': 115.2647491}","Banjar Panginyahan, Puhu, Payangan, Gianyar Regency, Bali 80572, Indonesia","Payangan, Gianyar"
https://www.booking.com/hotel/id/tegal-bamboo-cottages-amp-private-hot-spring.html?sid=b9709cd8ce176378f5bf317f22dd8ee4&aid=2230186&ucfs=1&arphpl=1&dest_id=835&dest_type=region&group_adults=2&req_adults=2&no_rooms=1&group_children=0&req_children=0&hpos=6&hapos=506&sr_order=popularity&srpvid=f0c23a7c639c0165&srepoch=1685175650&map_fdco=1&from=searchresults#hotelTmpl,Tegal Bamboo cottages & private hot spring,Baturaja,"Located 19 miles from Tegallalang Rice Terrace, Tegal Bamboo cottages & private hot spring has accommodations with a garden, a restaurant and room service for your convenience.",Moderate,8.7,Exceptional,30,"{'lat': -8.2442732, 'lng': 115.4015906}","Jalan Teringan Jl. Banjar Dalem, Songan A, Kec. Kintamani, Kabupaten Bangli, Bali 80652, Indonesia","Kintamani, Bangli"
https://www.booking.com/hotel/id/the-daha-a-luxury-resort-and-spa.html?sid=b9709cd8ce176378f5bf317f22dd8ee4&aid=2230186&ucfs=1&arphpl=1&dest_id=835&dest_type=region&group_adults=2&req_adults=2&no_rooms=1&group_children=0&req_children=0&hpos=7&hapos=507&sr_order=popularity&srpvid=f0c23a7c639c0165&srepoch=1685175650&from_sustainable_property_sr=1&map_fdco=1&from=searchresults#hotelTmpl,The Daha Luxury Villas,"Petitenget, Seminyak","Located 1.5 miles from Batu Belig Beach, The Daha Luxury Villas offers a garden, a bar and air-conditioned accommodations with a balcony and free WiFi. The accommodations have a hot tub.",Expensive,8.9,Exceptional,81,"{'lat': -8.6745596, 'lng': 115.1638461}","Gg. Anggrek, Kerobokan Kelod, Kec. Kuta Utara, Kabupaten Badung, Bali 80361, Indonesia","Kuta Utara, Badung"
https://www.booking.com/hotel/id/mejore.html?sid=b9709cd8ce176378f5bf317f22dd8ee4&aid=2230186&ucfs=1&arphpl=1&dest_id=835&dest_type=region&group_adults=2&req_adults=2&no_rooms=1&group_children=0&req_children=0&hpos=8&hapos=508&sr_order=popularity&srpvid=f0c23a7c639c0165&srepoch=1685175650&from_sustainable_property_sr=1&map_fdco=1&from=searchresults#hotelTmpl,Mejore Beach Hotel,Amed,"Mejore Beach Hotel features a restaurant, outdoor swimming pool, a bar and shared lounge in Amed. The 3-star hotel has air-conditioned rooms with a private bathroom.",Expensive,8.2,Good,306,"{'lat': -8.3354091, 'lng': 115.6516576}","Jl. I Ketut Natih, Abang, Kec. Abang, Kabupaten Karangasem, Bali 80852, Indonesia","Abang, Karangasem"
https://www.booking.com/hotel/id/lloyd-39-s-inn-bali-badung.html?sid=b9709cd8ce176378f5bf317f22dd8ee4&aid=2230186&ucfs=1&arphpl=1&dest_id=835&dest_type=region&group_adults=2&req_adults=2&no_rooms=1&group_children=0&req_children=0&hpos=9&hapos=509&sr_order=popularity&srpvid=f0c23a7c639c0165&srepoch=1685175650&from_sustainable_property_sr=1&map_fdco=1&from=searchresults#hotelTmpl,Lloyd's Inn Bali,Seminyak,"Lloyd's Inn Bali features an outdoor swimming pool, garden, a restaurant and bar in Seminyak.",Expensive,8.1,Good,1497,"{'lat': -8.6966208, 'lng': 115.1639482}","Jl. Arjuna, Seminyak, Kec. Kuta, Kabupaten Badung, Bali 80361, Indonesia","Kuta, Badung"
https://www.booking.com/hotel/id/lexington-klapa-resort.html?sid=b9709cd8ce176378f5bf317f22dd8ee4&aid=2230186&ucfs=1&arphpl=1&dest_id=835&dest_type=region&group_adults=2&req_adults=2&no_rooms=1&group_children=0&req_children=0&hpos=10&hapos=510&sr_order=popularity&srpvid=f0c23a7c639c0165&srepoch=1685175650&map_fdco=1&from=searchresults#hotelTmpl,Klapa Resort,Uluwatu,"Perched on a cliff in Uluwatu just a stone's throw away from Dreamland Beach and a 15-minute drive from Jimbaran Beach which is lined with fresh seafood dining options, Klapa Resort offers a...",Cheap,6.4,Exceptional,169,"{'lat': -8.7998291, 'lng': 115.1195395}","New Kuta Beach I, Jl. Raya Uluwatu, Pecatu, Kec. Kuta Sel., Kabupaten Badung, Bali 80364, Indonesia","Kuta Selatan, Badung"
https://www.booking.com/hotel/id/ubud-valley-boutique-resort.html?sid=b9709cd8ce176378f5bf317f22dd8ee4&aid=2230186&ucfs=1&arphpl=1&dest_id=835&dest_type=region&group_adults=2&req_adults=2&no_rooms=1&group_children=0&req_children=0&hpos=11&hapos=511&sr_order=popularity&srpvid=f0c23a7c639c0165&srepoch=1685175650&from_sustainable_property_sr=1&map_fdco=1&from=searchresults#hotelTmpl,Ubud Valley Boutique Resort,Ubud,"Set in Ubud, 3.1 mi from Elephant Cave, Ubud Valley Boutique Resort has a number of amenities including free bikes and free WiFi.",Expensive,9.6,Exceptional,381,"{'lat': -8.497638300000002, 'lng': 115.3057714}","Jl. Raya Pejeng Kangin, Pejeng Kangin, Kec. Tampaksiring, Kabupaten Gianyar, Bali 80552, Indonesia","Tampaksiring, Gianyar"
https://www.booking.com/hotel/id/umaya-ubud-villa.html?sid=b9709cd8ce176378f5bf317f22dd8ee4&aid=2230186&ucfs=1&arphpl=1&dest_id=835&dest_type=region&group_adults=2&req_adults=2&no_rooms=1&group_children=0&req_children=0&hpos=12&hapos=512&sr_order=popularity&srpvid=f0c23a7c639c0165&srepoch=1685175650&from_sustainable_property_sr=1&map_fdco=1&from=searchresults#hotelTmpl,Umaya Ubud Villa,Ubud,"Set in Ubud, only 656 feet from Monkey Forest Ubud, Umaya Ubud Villa offers accommodations with an outdoor pool.",Expensive,8.8,Exceptional,149,"{'lat': -8.519680000000001, 'lng': 115.2588272}","Jl. Nyuh Bojog No.34, Ubud, Kecamatan Ubud, Kabupaten Gianyar, Bali 80571, Indonesia","Ubud, Gianyar"
https://www.booking.com/hotel/id/umma-bali-menjangan.html?sid=b9709cd8ce176378f5bf317f22dd8ee4&aid=2230186&ucfs=1&arphpl=1&dest_id=835&dest_type=region&group_adults=2&req_adults=2&no_rooms=1&group_children=0&req_children=0&hpos=13&hapos=513&sr_order=popularity&srpvid=f0c23a7c639c0165&srepoch=1685175650&map_fdco=1&from=searchresults#hotelTmpl,Umma Bali Menjangan Retreat,Banyuwedang,"With mountain views, Umma Bali Menjangan Retreat is located in Banyuwedang and has a restaurant, room service, snack bar, garden, year-round outdoor pool and terrace.",Cheap,9.6,Exceptional,107,"{'lat': -8.1459297, 'lng': 114.5984562}","Gang Taman Tukad Salak, Sumberkima, Kec. Gerokgak, Kabupaten Buleleng, Bali 81155, Indonesia","Gerokgak, Buleleng"
https://www.booking.com/hotel/id/saka-boutique.html?sid=b9709cd8ce176378f5bf317f22dd8ee4&aid=2230186&ucfs=1&arphpl=1&dest_id=835&dest_type=region&group_adults=2&req_adults=2&no_rooms=1&group_children=0&req_children=0&hpos=14&hapos=514&sr_order=popularity&srpvid=f0c23a7c639c0165&srepoch=1685175650&map_fdco=1&from=searchresults#hotelTmpl,Saka Boutique Hotel,Nusa Penida,"Located in Nusa Penida, Saka Boutique Hotel has 3-star accommodations with private balconies.",Cheap,8.8,Exceptional,255,"{'lat': -8.6808228, 'lng': 115.4887624}","Jalan Raya Toyapakeh, Kampung Toyapakeh, Nusa Penida, Klungkung Regency, Bali 80771, Indonesia","Nusa Penida, Klungkung"
https://www.booking.com/hotel/id/black-pearl-hostel.html?sid=b9709cd8ce176378f5bf317f22dd8ee4&aid=2230186&ucfs=1&arphpl=1&dest_id=835&dest_type=region&group_adults=2&req_adults=2&no_rooms=1&group_children=0&req_children=0&hpos=15&hapos=515&sr_order=popularity&srpvid=f0c23a7c639c0165&srepoch=1685175650&map_fdco=1&from=searchresults#hotelTmpl,Black Pearl Hostel,"Batu Bolong, Canggu","Located in Canggu, a 6-minute walk from Batu Bolong Beach, Black Pearl Hostel has accommodations with an outdoor swimming pool, free private parking, a garden and a terrace.",Expensive,8.6,Exceptional,537,"{'lat': -8.657836099999999, 'lng': 115.1337301}","Jl. Lkr. Nelayan no No.222y, Canggu, Kec. Kuta Utara, Kabupaten Badung, Bali 80361, Indonesia","Kuta Utara, Badung"
https://www.booking.com/hotel/id/darmada-eco-resort.html?sid=b9709cd8ce176378f5bf317f22dd8ee4&aid=2230186&ucfs=1&arphpl=1&dest_id=835&dest_type=region&group_adults=2&req_adults=2&no_rooms=1&group_children=0&req_children=0&hpos=16&hapos=516&sr_order=popularity&srpvid=f0c23a7c639c0165&srepoch=1685175650&map_fdco=1&from=searchresults#hotelTmpl,Darmada Eco Resort,Sidemen,"Featuring an outdoor swimming pool, Darmada Eco Resort is located in Sidemen. This lovely and homey accommodations also offers an on-site restaurant and free on-site parking for guests who drive.",Expensive,9.1,Wonderful,152,"{'lat': -8.4689052, 'lng': 115.4392079}","Jl. Raya Darmada Banjar, Jl. Raya Tebola, Telaga Tawang, Sidemen, Karangasem Regency, Bali 80864, Indonesia","Sidemen, Karangasem"
https://www.booking.com/hotel/id/swiss-belinn-legian.html?sid=b9709cd8ce176378f5bf317f22dd8ee4&aid=2230186&ucfs=1&arphpl=1&dest_id=835&dest_type=region&group_adults=2&req_adults=2&no_rooms=1&group_children=0&req_children=0&hpos=17&hapos=517&sr_order=popularity&srpvid=f0c23a7c639c0165&srepoch=1685175650&from_sustainable_property_sr=1&map_fdco=1&from=searchresults#hotelTmpl,Swiss-Belinn Legian,"Padma, Legian","Located 5minutes’ walk from Legian Beach, Swiss-Belinn Legian features an outdoor swimming pool and a fitness center. Free Wi-Fi access is provided throughout the hotel.",Cheap,8,Good,484,"{'lat': -8.7016773, 'lng': 115.1670691}","Jl. Padma Utara, Legian, Kec. Kuta, Kabupaten Badung, Bali 80361, Indonesia","Kuta, Badung"
https://www.booking.com/hotel/id/sense-canggu-beach.html?sid=b9709cd8ce176378f5bf317f22dd8ee4&aid=2230186&ucfs=1&arphpl=1&dest_id=835&dest_type=region&group_adults=2&req_adults=2&no_rooms=1&group_children=0&req_children=0&hpos=18&hapos=518&sr_order=popularity&srpvid=f0c23a7c639c0165&srepoch=1685175650&map_fdco=1&from=searchresults#hotelTmpl,Sense Canggu Beach Hotel,"Pererenan, Canggu","A 7-minute walk from Echo Beach, Sense Canggu Beach Hotel is located in Canggu and provides air-conditioned rooms with free WiFi.",Moderate,7.7,Good,240,"{'lat': -8.6511242, 'lng': 115.1263136}","Jl. Munduk Kedungu No.55s, Pererenan, Kec. Mengwi, Kabupaten Badung, Bali, Indonesia","Mengwi, Badung"
https://www.booking.com/hotel/id/besakih-beach.html?sid=b9709cd8ce176378f5bf317f22dd8ee4&aid=2230186&ucfs=1&arphpl=1&dest_id=835&dest_type=region&group_adults=2&req_adults=2&no_rooms=1&group_children=0&req_children=0&hpos=19&hapos=519&sr_order=popularity&srpvid=f0c23a7c639c0165&srepoch=1685175650&map_fdco=1&from=searchresults#hotelTmpl,Besakih Beach Hotel,"Sanur Beach, Sanur","Located along the shores of Sanur Beach, Besakih Beach Hotel features a private beach area. Nestled in tropical gardens, it features an outdoor pool and offers massage services.",Moderate,7.9,Good,470,"{'lat': -8.6894444, 'lng': 115.2647222}","Jl. Danau Tamblingan No.45, Sanur, Denpasar Selatan, Kota Denpasar, Bali 80228, Indonesia","Denpasar Selatan, Denpasar"
https://www.booking.com/hotel/id/radha-phala-resort-amp-spa.html?sid=b9709cd8ce176378f5bf317f22dd8ee4&aid=2230186&ucfs=1&arphpl=1&dest_id=835&dest_type=region&group_adults=2&req_adults=2&no_rooms=1&group_children=0&req_children=0&hpos=20&hapos=520&sr_order=popularity&srpvid=f0c23a7c639c0165&srepoch=1685175650&from_sustainable_property_sr=1&map_fdco=1&from=searchresults#hotelTmpl,Radha Phala Resort & Spa,"Pengosekan, Ubud","Featuring an outdoor swimming pool and an on-site spa facility, Radha Phala Resort & Spa is located just a 15-minute drive from the famed Ubud Monkey forest and offers a great tropical getaway with...",Expensive,8.6,Exceptional,60,"{'lat': -8.533222199999999, 'lng': 115.2658215}","Jl. Cempaka, Banjar Kumbuh, MAS, Kecamatan Ubud, Kabupaten Gianyar, Bali 80571, Indonesia","Ubud, Gianyar"
https://www.booking.com/hotel/id/village-bali.html?sid=b9709cd8ce176378f5bf317f22dd8ee4&aid=2230186&ucfs=1&arphpl=1&dest_id=835&dest_type=region&group_adults=2&req_adults=2&no_rooms=1&group_children=0&req_children=0&hpos=21&hapos=521&sr_order=popularity&srpvid=f0c23a7c639c0165&srepoch=1685175650&from_sustainable_property_sr=1&map_fdco=1&from=searchresults#hotelTmpl,Village Bali,"Pecatu, Uluwatu","Located in Uluwatu, 656 feet from Impossible Beach, Village Bali provides accommodations with an outdoor swimming pool, free private parking, a bar and a garden.",Expensive,9.1,Wonderful,808,"{'lat': -8.8090953, 'lng': 115.1094068}","Jl. Pemutih, Pecatu, Kec. Kuta Sel., Kabupaten Badung, Bali 80361, Indonesia","Kuta Selatan, Badung"
https://www.booking.com/hotel/id/ning-ubud.html?sid=b9709cd8ce176378f5bf317f22dd8ee4&aid=2230186&ucfs=1&arphpl=1&dest_id=835&dest_type=region&group_adults=2&req_adults=2&no_rooms=1&group_children=0&req_children=0&hpos=22&hapos=522&sr_order=popularity&srpvid=f0c23a7c639c0165&srepoch=1685175650&from_sustainable_property_sr=1&map_fdco=1&from=searchresults#hotelTmpl,Ning Villa Ubud by Pramana Villas,"Downtown Ubud, Ubud","Located in Ubud, a 12-minute walk from Saraswati Temple, Ning Villa Ubud by Pramana Villas provides accommodations with an outdoor swimming pool, free private parking, a garden and a restaurant.",Cheap,8.2,Good,15,"{'lat': -8.511834799999999, 'lng': 115.2583771}","F7Q5+789, Ubud, Gianyar Regency, Bali 80571, Indonesia","Ubud, Gianyar"
https://www.booking.com/hotel/id/villa-cella-bella-ubud.html?sid=b9709cd8ce176378f5bf317f22dd8ee4&aid=2230186&ucfs=1&arphpl=1&dest_id=835&dest_type=region&group_adults=2&req_adults=2&no_rooms=1&group_children=0&req_children=0&hpos=23&hapos=523&sr_order=popularity&srpvid=f0c23a7c639c0165&srepoch=1685175650&from_sustainable_property_sr=1&map_fdco=1&from=searchresults#hotelTmpl,Villa Cella Bella Ubud,Ubud,"Located in Ubud, a 16-minute walk from Goa Gajah, Villa Cella Bella Ubud has accommodations with an outdoor swimming pool, free private parking, a garden and a terrace.",Expensive,9.3,Wonderful,49,"{'lat': -8.518473199999999, 'lng': 115.2808696}","Kemenuh, Sukawati, Gianyar Regency, Bali 80582, Indonesia","Sukawati, Gianyar"
https://www.booking.com/hotel/id/gunung-merta-bungalows.html?sid=b9709cd8ce176378f5bf317f22dd8ee4&aid=2230186&ucfs=1&arphpl=1&dest_id=835&dest_type=region&group_adults=2&req_adults=2&no_rooms=1&group_children=0&req_children=0&hpos=24&hapos=524&sr_order=popularity&srpvid=f0c23a7c639c0165&srepoch=1685175650&from_sustainable_property_sr=1&map_fdco=1&from=searchresults#hotelTmpl,Gunung Merta Bungalows,Ubud,"A 5-minute drive from restaurants and shops in central Ubud, Gunung Merta Bungalows provides an outdoor pool and free Wi-Fi in all areas. Guests can learn Balinese cooking and dancing on site.",Expensive,9.1,Wonderful,258,"{'lat': -8.507293599999999, 'lng': 115.2716707}","Jl. Raya Andong No.21, Peliatan, Kecamatan Ubud, Kabupaten Gianyar, Bali 80571, Indonesia","Ubud, Gianyar"
https://www.booking.com/hotel/id/lafyu-bali.html?sid=b9709cd8ce176378f5bf317f22dd8ee4&aid=2230186&ucfs=1&arphpl=1&dest_id=835&dest_type=region&group_adults=2&req_adults=2&no_rooms=1&group_children=0&req_children=0&hpos=25&hapos=525&sr_order=popularity&srpvid=f0c23a7c639c0165&srepoch=1685175650&map_fdco=1&from=searchresults#hotelTmpl,Lafyu Bali,Singaraja,"Offering sea views, Lafyu Bali in Singaraja has accommodations, an outdoor swimming pool, a garden, a terrace and a restaurant.",Expensive,9.2,Wonderful,101,"{'lat': -8.166260399999999, 'lng': 115.103553}","Jalan I Gusti Ketut Jejer, Sambangan, Kec. Sukasada, Kabupaten Buleleng, Bali 81161, Indonesia","Sukasada, Buleleng"
https://www.booking.com/hotel/id/sanur-paradise-plaza-hotel.html?sid=b9709cd8ce176378f5bf317f22dd8ee4&aid=2230186&ucfs=1&arphpl=1&dest_id=835&dest_type=region&group_adults=2&req_adults=2&no_rooms=1&group_children=0&req_children=0&hpos=2&hapos=527&sr_order=popularity&srpvid=f0c23a7c639c0165&srepoch=1685175652&map_fdco=1&from=searchresults#hotelTmpl,Prime Plaza Hotel Sanur – Bali,"Sanur Beach, Sanur","Set within tropical gardens, just a 10-minute walk from Sanur Beach, Prime Plaza Hotel Sanur - Bali offers elegant Balinese-style rooms with marble flooring and free WiFi.",Expensive,8.1,Good,372,"{'lat': -8.6759624, 'lng': 115.2601494}","Jl. Hang Tuah No.46, Sanur Kaja, Denpasar Selatan, Kota Denpasar, Bali 80228, Indonesia","Denpasar Selatan, Denpasar"
https://www.booking.com/hotel/id/titik-dua.html?sid=b9709cd8ce176378f5bf317f22dd8ee4&aid=2230186&ucfs=1&arphpl=1&dest_id=835&dest_type=region&group_adults=2&req_adults=2&no_rooms=1&group_children=0&req_children=0&hpos=3&hapos=528&sr_order=popularity&srpvid=f0c23a7c639c0165&srepoch=1685175652&from_sustainable_property_sr=1&map_fdco=1&from=searchresults#hotelTmpl,Titik Dua,Ubud,"Located in Ubud, 1.4 miles from Goa Gajah, Titik Dua has accommodations with an outdoor swimming pool, free private parking, a garden and a terrace.",Expensive,9.3,Wonderful,261,"{'lat': -8.5280528, 'lng': 115.2707408}","Jl. Cok Rai Pudak No.48, Peliatan, Kecamatan Ubud, Kabupaten Gianyar, Bali 80571, Indonesia","Ubud, Gianyar"
https://www.booking.com/hotel/id/karmagali-suites.html?sid=b9709cd8ce176378f5bf317f22dd8ee4&aid=2230186&ucfs=1&arphpl=1&dest_id=835&dest_type=region&group_adults=2&req_adults=2&no_rooms=1&group_children=0&req_children=0&hpos=4&hapos=529&sr_order=popularity&srpvid=f0c23a7c639c0165&srepoch=1685175652&from_sustainable_property_sr=1&map_fdco=1&from=searchresults#hotelTmpl,Karmagali Boutique Suites - adults only & Private Villas,"Sanur Beach, Sanur","Set in Sanur, Karmagali Boutique Suites - adults only & Private Villas Suites offers a luxurious tropical getaway featuring an outdoor swimming pool.",Expensive,9.2,Wonderful,71,"{'lat': -8.689688499999999, 'lng': 115.2602771}","Jalan Pungutan n24B, Sanur, Denpasar Selatan, Kota Denpasar, Bali 80228, Indonesia","Denpasar Selatan, Denpasar"
https://www.booking.com/hotel/id/horison-seminyak.html?sid=b9709cd8ce176378f5bf317f22dd8ee4&aid=2230186&ucfs=1&arphpl=1&dest_id=835&dest_type=region&group_adults=2&req_adults=2&no_rooms=1&group_children=0&req_children=0&hpos=5&hapos=530&sr_order=popularity&srpvid=f0c23a7c639c0165&srepoch=1685175652&from_sustainable_property_sr=1&map_fdco=1&from=searchresults#hotelTmpl,Horison Seminyak Bali - CHSE Certified,"Double Six, Seminyak","A 2-minute walk from Seminyak shopping and dining area, Horison Seminyak Bali - CHSE Certified houses an outdoor swimming pool and spacious air-conditioned rooms.",Moderate,7.6,Good,525,"{'lat': -8.6966438, 'lng': 115.1660759}","Jl. Arjuna, Seminyak, Kec. Kuta, Kabupaten Badung, Bali 80361, Indonesia","Kuta, Badung"
https://www.booking.com/hotel/id/suka-sari-home-stay.html?sid=b9709cd8ce176378f5bf317f22dd8ee4&aid=2230186&ucfs=1&arphpl=1&dest_id=835&dest_type=region&group_adults=2&req_adults=2&no_rooms=1&group_children=0&req_children=0&hpos=6&hapos=531&sr_order=popularity&srpvid=f0c23a7c639c0165&srepoch=1685175652&map_fdco=1&from=searchresults#hotelTmpl,Suka Sari Cottages,Pemuteran,"Suka Sari Cottages is located in the Pemuteran area, a 5-minute drive from Pulaki Temple, and a 30-minute drive from Gilimanuk Harbor. It offers free on-site parking.",Cheap,9,Wonderful,70,"{'lat': -8.1460606, 'lng': 114.6558883}","Jl. Singaraja-Gilimanuk, Pemuteran, Kec. Gerokgak, Kabupaten Buleleng, Bali 81155, Indonesia","Gerokgak, Buleleng"
https://www.booking.com/hotel/id/rumah-lada.html?sid=b9709cd8ce176378f5bf317f22dd8ee4&aid=2230186&ucfs=1&arphpl=1&dest_id=835&dest_type=region&group_adults=2&req_adults=2&no_rooms=1&group_children=0&req_children=0&hpos=7&hapos=532&sr_order=popularity&srpvid=f0c23a7c639c0165&srepoch=1685175652&from_sustainable_property_sr=1&map_fdco=1&from=searchresults#hotelTmpl,Canvas Escape Resort,Ubud,"Located in Ubud, 3.2 miles from Ubud Monkey Forest, Canvas Escape Resort provides accommodations with an outdoor swimming pool, free private parking, a garden and a terrace.",Cheap,8.4,Good,91,"{'lat': -8.5590546, 'lng': 115.2611344}","Jl. A.A. Gede Rai No.21, Lodtunduh, Kecamatan Ubud, Kabupaten Gianyar, Bali 80571, Indonesia","Ubud, Gianyar"
https://www.booking.com/hotel/id/passgo-digital-airport-bali.html?sid=b9709cd8ce176378f5bf317f22dd8ee4&aid=2230186&ucfs=1&arphpl=1&dest_id=835&dest_type=region&group_adults=2&req_adults=2&no_rooms=1&group_children=0&req_children=0&hpos=8&hapos=533&sr_order=popularity&srpvid=f0c23a7c639c0165&srepoch=1685175652&map_fdco=1&from=searchresults#hotelTmpl,PassGo Digital Airport Hotel Bali,"Tuban, Kuta",PassGo Digital Airport Hotel Bali features air-conditioned rooms with flat-screen TV in the Tuban district of Kuta.,Expensive,8.8,Exceptional,283,"{'lat': -8.7426681, 'lng': 115.1665204}","Ngurah Rai International Airport, Terminal, Tuban, Kec. Kuta, Kabupaten Badung, Bali 80362, Indonesia","Kuta, Badung"
https://www.booking.com/hotel/id/kubu-d-39-ume-homestay.html?sid=b9709cd8ce176378f5bf317f22dd8ee4&aid=2230186&ucfs=1&arphpl=1&dest_id=835&dest_type=region&group_adults=2&req_adults=2&no_rooms=1&group_children=0&req_children=0&hpos=9&hapos=534&sr_order=popularity&srpvid=f0c23a7c639c0165&srepoch=1685175652&map_fdco=1&from=searchresults#hotelTmpl,KUBU D'UME HOMESTAY,Jatiluwih,"Located in Jatiluwih in the Bali region and Tanah Lot Temple reachable within 21 miles, KUBU D'UME HOMESTAY has accommodations with free WiFi, a playground, a garden and free private parking.",Expensive,9.6,Exceptional,151,"{'lat': -8.3924031, 'lng': 115.1222141}","J45C+2VW, Jl. Batu Luwih Kawan, Mengesta, Kec. Penebel, Kabupaten Tabanan, Bali 82152, Indonesia","Penebel, Tabanan"
https://www.booking.com/hotel/id/frii-bali-echo-beach.html?sid=b9709cd8ce176378f5bf317f22dd8ee4&aid=2230186&ucfs=1&arphpl=1&dest_id=835&dest_type=region&group_adults=2&req_adults=2&no_rooms=1&group_children=0&req_children=0&hpos=10&hapos=535&sr_order=popularity&srpvid=f0c23a7c639c0165&srepoch=1685175652&from_sustainable_property_sr=1&map_fdco=1&from=searchresults#hotelTmpl,FRii Bali Echo Beach,"Batu Bolong, Canggu","Located in Canggu, FRii Bali Echo Beach offers an outdoor pool and free WiFi access in all of the areas in the property.",Moderate,7.1,Good,439,"{'lat': -8.6539859, 'lng': 115.1303691}","Jl. Munduk Catu No.32, Canggu, Kec. Kuta Utara, Kabupaten Badung, Bali 80361, Indonesia","Kuta Utara, Badung"
