source_href,name_hotel,region,description,price_label,rating,rating_type,review_count
https://www.booking.com/hotel/id/furamaxclusive-ocean-beach-seminyak-bali.html?sid=b9709cd8ce176378f5bf317f22dd8ee4&aid=2230186&ucfs=1&arphpl=1&dest_id=835&dest_type=region&group_adults=2&req_adults=2&no_rooms=1&group_children=0&req_children=0&hpos=19&hapos=494&sr_order=popularity&srpvid=f0c23a7c639c0165&srepoch=1685175648&map_fdco=1&from=searchresults#hotelTmpl,FuramaXclusive Ocean Beach Seminyak Bali,"Padma, Legian","Located along the sandy shores of Legian Beach, FuramaXclusive Ocean Beach Seminyak Bali offers stylish apartments with an iPod dock and free WiFi access.",Cheap,7.2,Good,493
https://www.booking.com/hotel/id/balikayanas-bamboo-house-miggiell-house.html?sid=b9709cd8ce176378f5bf317f22dd8ee4&aid=2230186&ucfs=1&arphpl=1&dest_id=835&dest_type=region&group_adults=2&req_adults=2&no_rooms=1&group_children=0&req_children=0&hpos=20&hapos=495&sr_order=popularity&srpvid=f0c23a7c639c0165&srepoch=1685175648&map_fdco=1&from=searchresults#hotelTmpl,Balikayanas Bamboo House - Miggiell House,Karangasem,"Featuring an outdoor swimming pool and a terrace, Balikayanas Bamboo House - Miggiell House provides accommodations in Karangasem with free WiFi and garden views.",Expensive,9.2,Wonderful,67
https://www.booking.com/hotel/id/puri-hiromi.html?sid=b9709cd8ce176378f5bf317f22dd8ee4&aid=2230186&ucfs=1&arphpl=1&dest_id=835&dest_type=region&group_adults=2&req_adults=2&no_rooms=1&group_children=0&req_children=0&hpos=21&hapos=496&sr_order=popularity&srpvid=f0c23a7c639c0165&srepoch=1685175648&from_sustainable_property_sr=1&map_fdco=1&from=searchresults#hotelTmpl,Puri Hiromi Boutique Residence,"Sanur Beach, Sanur",Puri Hiromi is a 5-minute walk to the sandy beaches of Sanur. It provides free parking and features suites with a cable TV and kitchenette.,Expensive,8.9,Exceptional,161
https://www.booking.com/hotel/id/pop-hardys-singaraja-square-singaraja.html?sid=b9709cd8ce176378f5bf317f22dd8ee4&aid=2230186&ucfs=1&arphpl=1&dest_id=835&dest_type=region&group_adults=2&req_adults=2&no_rooms=1&group_children=0&req_children=0&hpos=22&hapos=497&sr_order=popularity&srpvid=f0c23a7c639c0165&srepoch=1685175648&map_fdco=1&from=searchresults#hotelTmpl,Singaraja Hotel - CHSE Certified,Singaraja,"Offering a beachfront accommodations with a sea-view outdoor pool, Singaraja Hotel - CHSE Certified is located in downtown Singaraja.",Moderate,7.2,Good,132
https://www.booking.com/hotel/id/agaliving-villa.html?sid=b9709cd8ce176378f5bf317f22dd8ee4&aid=2230186&ucfs=1&arphpl=1&dest_id=835&dest_type=region&group_adults=2&req_adults=2&no_rooms=1&group_children=0&req_children=0&hpos=23&hapos=498&sr_order=popularity&srpvid=f0c23a7c639c0165&srepoch=1685175648&from_sustainable_property_sr=1&map_fdco=1&from=searchresults#hotelTmpl,AgaLiving Medewi,"Medewi, Pulukan","Featuring a swimming pool, a garden, a terrace and views of the garden, AgaLiving Medewi is located in Pulukan and has accommodations with free WiFi.",Cheap,9.5,Exceptional,244
https://www.booking.com/hotel/id/bebek-cottages-sanur.html?sid=b9709cd8ce176378f5bf317f22dd8ee4&aid=2230186&ucfs=1&arphpl=1&dest_id=835&dest_type=region&group_adults=2&req_adults=2&no_rooms=1&group_children=0&req_children=0&hpos=24&hapos=499&sr_order=popularity&srpvid=f0c23a7c639c0165&srepoch=1685175648&map_fdco=1&from=searchresults#hotelTmpl,Bebek Cottages Sanur,"Sanur Beach, Sanur","Bebek Cottages Sanur has an outdoor swimming pool, garden, a terrace and restaurant in Sanur.",Expensive,9.1,Wonderful,190
https://www.booking.com/hotel/id/surya-chandra-beach-bungalow.html?sid=b9709cd8ce176378f5bf317f22dd8ee4&aid=2230186&ucfs=1&arphpl=1&dest_id=835&dest_type=region&group_adults=2&req_adults=2&no_rooms=1&group_children=0&req_children=0&hpos=25&hapos=500&sr_order=popularity&srpvid=f0c23a7c639c0165&srepoch=1685175648&from_sustainable_property_sr=1&map_fdco=1&from=searchresults#hotelTmpl,Surya Chandra Beach Bungalow,Nusa Penida,"Featuring a year-round outdoor pool, Surya Chandra Beach Bungalow in Nusa Penida provides accommodations with free WiFi and free private parking for guests who drive.",Expensive,8.6,Exceptional,171
https://www.booking.com/hotel/id/pondok-tamiu.html?sid=b9709cd8ce176378f5bf317f22dd8ee4&aid=2230186&ucfs=1&arphpl=1&dest_id=835&dest_type=region&group_adults=2&req_adults=2&no_rooms=1&group_children=0&req_children=0&hpos=2&hapos=502&sr_order=popularity&srpvid=f0c23a7c639c0165&srepoch=1685175650&map_fdco=1&from=searchresults#hotelTmpl,Pondok Tamiu,"Downtown Ubud, Ubud","Well set in the center of Ubud, Pondok Tamiu provides air-conditioned rooms, an outdoor swimming pool, free WiFi and a garden.",Cheap,8.9,Exceptional,98
https://www.booking.com/hotel/id/bliss-ubud-abangan.html?sid=b9709cd8ce176378f5bf317f22dd8ee4&aid=2230186&ucfs=1&arphpl=1&dest_id=835&dest_type=region&group_adults=2&req_adults=2&no_rooms=1&group_children=0&req_children=0&hpos=3&hapos=503&sr_order=popularity&srpvid=f0c23a7c639c0165&srepoch=1685175650&from_sustainable_property_sr=1&map_fdco=1&from=searchresults#hotelTmpl,Bliss Ubud Abangan,"Downtown Ubud, Ubud","Located 500 yards from the center of Ubud, a 6-minute walk from Saraswati Temple, Bliss Ubud Abangan has air-conditioned accommodations with a terrace, an outdoor swimming pool and a garden.",Expensive,8.7,Exceptional,372
https://www.booking.com/hotel/id/galalima-glamping.html?sid=b9709cd8ce176378f5bf317f22dd8ee4&aid=2230186&ucfs=1&arphpl=1&dest_id=835&dest_type=region&group_adults=2&req_adults=2&no_rooms=1&group_children=0&req_children=0&hpos=4&hapos=504&sr_order=popularity&srpvid=f0c23a7c639c0165&srepoch=1685175650&from_sustainable_property_sr=1&map_fdco=1&from=searchresults#hotelTmpl,Galalima Glamping,Meliling,"Offering garden views, Galalima Glamping in Meliling has accommodations, an outdoor swimming pool, a garden, a terrace and a restaurant. Complimentary WiFi is offered throughout the property.",Cheap,8.9,Exceptional,17
https://www.booking.com/hotel/id/senetan-villas-amp-spa-resort.html?sid=b9709cd8ce176378f5bf317f22dd8ee4&aid=2230186&ucfs=1&arphpl=1&dest_id=835&dest_type=region&group_adults=2&req_adults=2&no_rooms=1&group_children=0&req_children=0&hpos=5&hapos=505&sr_order=popularity&srpvid=f0c23a7c639c0165&srepoch=1685175650&from_sustainable_property_sr=1&map_fdco=1&from=searchresults#hotelTmpl,Senetan Villas and Spa Resort,Payangan,"Located in the tranquil area of Ubud, Senetan Villas and Spa Resort offers a wonderful retreat villa featuring private outdoor swimming pool and free WiFi access.",Cheap,8.6,Exceptional,76
https://www.booking.com/hotel/id/tegal-bamboo-cottages-amp-private-hot-spring.html?sid=b9709cd8ce176378f5bf317f22dd8ee4&aid=2230186&ucfs=1&arphpl=1&dest_id=835&dest_type=region&group_adults=2&req_adults=2&no_rooms=1&group_children=0&req_children=0&hpos=6&hapos=506&sr_order=popularity&srpvid=f0c23a7c639c0165&srepoch=1685175650&map_fdco=1&from=searchresults#hotelTmpl,Tegal Bamboo cottages & private hot spring,Baturaja,"Located 19 miles from Tegallalang Rice Terrace, Tegal Bamboo cottages & private hot spring has accommodations with a garden, a restaurant and room service for your convenience.",Moderate,8.7,Exceptional,30
https://www.booking.com/hotel/id/the-daha-a-luxury-resort-and-spa.html?sid=b9709cd8ce176378f5bf317f22dd8ee4&aid=2230186&ucfs=1&arphpl=1&dest_id=835&dest_type=region&group_adults=2&req_adults=2&no_rooms=1&group_children=0&req_children=0&hpos=7&hapos=507&sr_order=popularity&srpvid=f0c23a7c639c0165&srepoch=1685175650&from_sustainable_property_sr=1&map_fdco=1&from=searchresults#hotelTmpl,The Daha Luxury Villas,"Petitenget, Seminyak","Located 1.5 miles from Batu Belig Beach, The Daha Luxury Villas offers a garden, a bar and air-conditioned accommodations with a balcony and free WiFi. The accommodations have a hot tub.",Expensive,8.9,Exceptional,81
https://www.booking.com/hotel/id/mejore.html?sid=b9709cd8ce176378f5bf317f22dd8ee4&aid=2230186&ucfs=1&arphpl=1&dest_id=835&dest_type=region&group_adults=2&req_adults=2&no_rooms=1&group_children=0&req_children=0&hpos=8&hapos=508&sr_order=popularity&srpvid=f0c23a7c639c0165&srepoch=1685175650&from_sustainable_property_sr=1&map_fdco=1&from=searchresults#hotelTmpl,Mejore Beach Hotel,Amed,"Mejore Beach Hotel features a restaurant, outdoor swimming pool, a bar and shared lounge in Amed. The 3-star hotel has air-conditioned rooms with a private bathroom.",Expensive,8.2,Good,306
https://www.booking.com/hotel/id/lloyd-39-s-inn-bali-badung.html?sid=b9709cd8ce176378f5bf317f22dd8ee4&aid=2230186&ucfs=1&arphpl=1&dest_id=835&dest_type=region&group_adults=2&req_adults=2&no_rooms=1&group_children=0&req_children=0&hpos=9&hapos=509&sr_order=popularity&srpvid=f0c23a7c639c0165&srepoch=1685175650&from_sustainable_property_sr=1&map_fdco=1&from=searchresults#hotelTmpl,Lloyd's Inn Bali,Seminyak,"Lloyd's Inn Bali features an outdoor swimming pool, garden, a restaurant and bar in Seminyak.",Expensive,8.1,Good,"1,497"
https://www.booking.com/hotel/id/lexington-klapa-resort.html?sid=b9709cd8ce176378f5bf317f22dd8ee4&aid=2230186&ucfs=1&arphpl=1&dest_id=835&dest_type=region&group_adults=2&req_adults=2&no_rooms=1&group_children=0&req_children=0&hpos=10&hapos=510&sr_order=popularity&srpvid=f0c23a7c639c0165&srepoch=1685175650&map_fdco=1&from=searchresults#hotelTmpl,Klapa Resort,Uluwatu,"Perched on a cliff in Uluwatu just a stone's throw away from Dreamland Beach and a 15-minute drive from Jimbaran Beach which is lined with fresh seafood dining options, Klapa Resort offers a...",Cheap,6.4,Exceptional,169
https://www.booking.com/hotel/id/ubud-valley-boutique-resort.html?sid=b9709cd8ce176378f5bf317f22dd8ee4&aid=2230186&ucfs=1&arphpl=1&dest_id=835&dest_type=region&group_adults=2&req_adults=2&no_rooms=1&group_children=0&req_children=0&hpos=11&hapos=511&sr_order=popularity&srpvid=f0c23a7c639c0165&srepoch=1685175650&from_sustainable_property_sr=1&map_fdco=1&from=searchresults#hotelTmpl,Ubud Valley Boutique Resort,Ubud,"Set in Ubud, 3.1 mi from Elephant Cave, Ubud Valley Boutique Resort has a number of amenities including free bikes and free WiFi.",Expensive,9.6,Exceptional,381
https://www.booking.com/hotel/id/umaya-ubud-villa.html?sid=b9709cd8ce176378f5bf317f22dd8ee4&aid=2230186&ucfs=1&arphpl=1&dest_id=835&dest_type=region&group_adults=2&req_adults=2&no_rooms=1&group_children=0&req_children=0&hpos=12&hapos=512&sr_order=popularity&srpvid=f0c23a7c639c0165&srepoch=1685175650&from_sustainable_property_sr=1&map_fdco=1&from=searchresults#hotelTmpl,Umaya Ubud Villa,Ubud,"Set in Ubud, only 656 feet from Monkey Forest Ubud, Umaya Ubud Villa offers accommodations with an outdoor pool.",Expensive,8.8,Exceptional,149
https://www.booking.com/hotel/id/umma-bali-menjangan.html?sid=b9709cd8ce176378f5bf317f22dd8ee4&aid=2230186&ucfs=1&arphpl=1&dest_id=835&dest_type=region&group_adults=2&req_adults=2&no_rooms=1&group_children=0&req_children=0&hpos=13&hapos=513&sr_order=popularity&srpvid=f0c23a7c639c0165&srepoch=1685175650&map_fdco=1&from=searchresults#hotelTmpl,Umma Bali Menjangan Retreat,Banyuwedang,"With mountain views, Umma Bali Menjangan Retreat is located in Banyuwedang and has a restaurant, room service, snack bar, garden, year-round outdoor pool and terrace.",Cheap,9.6,Exceptional,107
https://www.booking.com/hotel/id/saka-boutique.html?sid=b9709cd8ce176378f5bf317f22dd8ee4&aid=2230186&ucfs=1&arphpl=1&dest_id=835&dest_type=region&group_adults=2&req_adults=2&no_rooms=1&group_children=0&req_children=0&hpos=14&hapos=514&sr_order=popularity&srpvid=f0c23a7c639c0165&srepoch=1685175650&map_fdco=1&from=searchresults#hotelTmpl,Saka Boutique Hotel,Nusa Penida,"Located in Nusa Penida, Saka Boutique Hotel has 3-star accommodations with private balconies.",Cheap,8.8,Exceptional,255
https://www.booking.com/hotel/id/black-pearl-hostel.html?sid=b9709cd8ce176378f5bf317f22dd8ee4&aid=2230186&ucfs=1&arphpl=1&dest_id=835&dest_type=region&group_adults=2&req_adults=2&no_rooms=1&group_children=0&req_children=0&hpos=15&hapos=515&sr_order=popularity&srpvid=f0c23a7c639c0165&srepoch=1685175650&map_fdco=1&from=searchresults#hotelTmpl,Black Pearl Hostel,"Batu Bolong, Canggu","Located in Canggu, a 6-minute walk from Batu Bolong Beach, Black Pearl Hostel has accommodations with an outdoor swimming pool, free private parking, a garden and a terrace.",Expensive,8.6,Exceptional,537
https://www.booking.com/hotel/id/darmada-eco-resort.html?sid=b9709cd8ce176378f5bf317f22dd8ee4&aid=2230186&ucfs=1&arphpl=1&dest_id=835&dest_type=region&group_adults=2&req_adults=2&no_rooms=1&group_children=0&req_children=0&hpos=16&hapos=516&sr_order=popularity&srpvid=f0c23a7c639c0165&srepoch=1685175650&map_fdco=1&from=searchresults#hotelTmpl,Darmada Eco Resort,Sidemen,"Featuring an outdoor swimming pool, Darmada Eco Resort is located in Sidemen. This lovely and homey accommodations also offers an on-site restaurant and free on-site parking for guests who drive.",Expensive,9.1,Wonderful,152
https://www.booking.com/hotel/id/swiss-belinn-legian.html?sid=b9709cd8ce176378f5bf317f22dd8ee4&aid=2230186&ucfs=1&arphpl=1&dest_id=835&dest_type=region&group_adults=2&req_adults=2&no_rooms=1&group_children=0&req_children=0&hpos=17&hapos=517&sr_order=popularity&srpvid=f0c23a7c639c0165&srepoch=1685175650&from_sustainable_property_sr=1&map_fdco=1&from=searchresults#hotelTmpl,Swiss-Belinn Legian,"Padma, Legian","Located 5minutes’ walk from Legian Beach, Swiss-Belinn Legian features an outdoor swimming pool and a fitness center. Free Wi-Fi access is provided throughout the hotel.",Cheap,8,Good,484
https://www.booking.com/hotel/id/sense-canggu-beach.html?sid=b9709cd8ce176378f5bf317f22dd8ee4&aid=2230186&ucfs=1&arphpl=1&dest_id=835&dest_type=region&group_adults=2&req_adults=2&no_rooms=1&group_children=0&req_children=0&hpos=18&hapos=518&sr_order=popularity&srpvid=f0c23a7c639c0165&srepoch=1685175650&map_fdco=1&from=searchresults#hotelTmpl,Sense Canggu Beach Hotel,"Pererenan, Canggu","A 7-minute walk from Echo Beach, Sense Canggu Beach Hotel is located in Canggu and provides air-conditioned rooms with free WiFi.",Moderate,7.7,Good,240
https://www.booking.com/hotel/id/besakih-beach.html?sid=b9709cd8ce176378f5bf317f22dd8ee4&aid=2230186&ucfs=1&arphpl=1&dest_id=835&dest_type=region&group_adults=2&req_adults=2&no_rooms=1&group_children=0&req_children=0&hpos=19&hapos=519&sr_order=popularity&srpvid=f0c23a7c639c0165&srepoch=1685175650&map_fdco=1&from=searchresults#hotelTmpl,Besakih Beach Hotel,"Sanur Beach, Sanur","Located along the shores of Sanur Beach, Besakih Beach Hotel features a private beach area. Nestled in tropical gardens, it features an outdoor pool and offers massage services.",Moderate,7.9,Good,470
https://www.booking.com/hotel/id/radha-phala-resort-amp-spa.html?sid=b9709cd8ce176378f5bf317f22dd8ee4&aid=2230186&ucfs=1&arphpl=1&dest_id=835&dest_type=region&group_adults=2&req_adults=2&no_rooms=1&group_children=0&req_children=0&hpos=20&hapos=520&sr_order=popularity&srpvid=f0c23a7c639c0165&srepoch=1685175650&from_sustainable_property_sr=1&map_fdco=1&from=searchresults#hotelTmpl,Radha Phala Resort & Spa,"Pengosekan, Ubud","Featuring an outdoor swimming pool and an on-site spa facility, Radha Phala Resort & Spa is located  just a 15-minute drive from the famed Ubud Monkey forest and offers a great tropical getaway with...",Expensive,8.6,Exceptional,60
https://www.booking.com/hotel/id/village-bali.html?sid=b9709cd8ce176378f5bf317f22dd8ee4&aid=2230186&ucfs=1&arphpl=1&dest_id=835&dest_type=region&group_adults=2&req_adults=2&no_rooms=1&group_children=0&req_children=0&hpos=21&hapos=521&sr_order=popularity&srpvid=f0c23a7c639c0165&srepoch=1685175650&from_sustainable_property_sr=1&map_fdco=1&from=searchresults#hotelTmpl,Village Bali,"Pecatu, Uluwatu","Located in Uluwatu, 656 feet from Impossible Beach, Village Bali provides accommodations with an outdoor swimming pool, free private parking, a bar and a garden.",Expensive,9.1,Wonderful,808
https://www.booking.com/hotel/id/ning-ubud.html?sid=b9709cd8ce176378f5bf317f22dd8ee4&aid=2230186&ucfs=1&arphpl=1&dest_id=835&dest_type=region&group_adults=2&req_adults=2&no_rooms=1&group_children=0&req_children=0&hpos=22&hapos=522&sr_order=popularity&srpvid=f0c23a7c639c0165&srepoch=1685175650&from_sustainable_property_sr=1&map_fdco=1&from=searchresults#hotelTmpl,Ning Villa Ubud by Pramana Villas,"Downtown Ubud, Ubud","Located in Ubud, a 12-minute walk from Saraswati Temple, Ning Villa Ubud by Pramana Villas provides accommodations with an outdoor swimming pool, free private parking, a garden and a restaurant.",Cheap,8.2,Good,15
https://www.booking.com/hotel/id/villa-cella-bella-ubud.html?sid=b9709cd8ce176378f5bf317f22dd8ee4&aid=2230186&ucfs=1&arphpl=1&dest_id=835&dest_type=region&group_adults=2&req_adults=2&no_rooms=1&group_children=0&req_children=0&hpos=23&hapos=523&sr_order=popularity&srpvid=f0c23a7c639c0165&srepoch=1685175650&from_sustainable_property_sr=1&map_fdco=1&from=searchresults#hotelTmpl,Villa Cella Bella Ubud,Ubud,"Located in Ubud, a 16-minute walk from Goa Gajah, Villa Cella Bella Ubud has accommodations with an outdoor swimming pool, free private parking, a garden and a terrace.",Expensive,9.3,Wonderful,49
https://www.booking.com/hotel/id/gunung-merta-bungalows.html?sid=b9709cd8ce176378f5bf317f22dd8ee4&aid=2230186&ucfs=1&arphpl=1&dest_id=835&dest_type=region&group_adults=2&req_adults=2&no_rooms=1&group_children=0&req_children=0&hpos=24&hapos=524&sr_order=popularity&srpvid=f0c23a7c639c0165&srepoch=1685175650&from_sustainable_property_sr=1&map_fdco=1&from=searchresults#hotelTmpl,Gunung Merta Bungalows,Ubud,"A 5-minute drive from restaurants and shops in central Ubud, Gunung Merta Bungalows provides an outdoor pool and free Wi-Fi in all areas. Guests can learn Balinese cooking and dancing on site.",Expensive,9.1,Wonderful,258
https://www.booking.com/hotel/id/lafyu-bali.html?sid=b9709cd8ce176378f5bf317f22dd8ee4&aid=2230186&ucfs=1&arphpl=1&dest_id=835&dest_type=region&group_adults=2&req_adults=2&no_rooms=1&group_children=0&req_children=0&hpos=25&hapos=525&sr_order=popularity&srpvid=f0c23a7c639c0165&srepoch=1685175650&map_fdco=1&from=searchresults#hotelTmpl,Lafyu Bali,Singaraja,"Offering sea views, Lafyu Bali in Singaraja has accommodations, an outdoor swimming pool, a garden, a terrace and a restaurant.",Expensive,9.2,Wonderful,101
https://www.booking.com/hotel/id/sanur-paradise-plaza-hotel.html?sid=b9709cd8ce176378f5bf317f22dd8ee4&aid=2230186&ucfs=1&arphpl=1&dest_id=835&dest_type=region&group_adults=2&req_adults=2&no_rooms=1&group_children=0&req_children=0&hpos=2&hapos=527&sr_order=popularity&srpvid=f0c23a7c639c0165&srepoch=1685175652&map_fdco=1&from=searchresults#hotelTmpl,Prime Plaza Hotel Sanur – Bali,"Sanur Beach, Sanur","Set within tropical gardens, just a 10-minute walk from Sanur Beach, Prime Plaza Hotel Sanur - Bali offers elegant Balinese-style rooms with marble flooring and free WiFi.",Expensive,8.1,Good,372
https://www.booking.com/hotel/id/titik-dua.html?sid=b9709cd8ce176378f5bf317f22dd8ee4&aid=2230186&ucfs=1&arphpl=1&dest_id=835&dest_type=region&group_adults=2&req_adults=2&no_rooms=1&group_children=0&req_children=0&hpos=3&hapos=528&sr_order=popularity&srpvid=f0c23a7c639c0165&srepoch=1685175652&from_sustainable_property_sr=1&map_fdco=1&from=searchresults#hotelTmpl,Titik Dua,Ubud,"Located in Ubud, 1.4 miles from Goa Gajah, Titik Dua has accommodations with an outdoor swimming pool, free private parking, a garden and a terrace.",Expensive,9.3,Wonderful,261
https://www.booking.com/hotel/id/karmagali-suites.html?sid=b9709cd8ce176378f5bf317f22dd8ee4&aid=2230186&ucfs=1&arphpl=1&dest_id=835&dest_type=region&group_adults=2&req_adults=2&no_rooms=1&group_children=0&req_children=0&hpos=4&hapos=529&sr_order=popularity&srpvid=f0c23a7c639c0165&srepoch=1685175652&from_sustainable_property_sr=1&map_fdco=1&from=searchresults#hotelTmpl,Karmagali Boutique Suites - adults only & Private Villas,"Sanur Beach, Sanur","Set in Sanur, Karmagali Boutique Suites - adults only & Private Villas Suites offers a luxurious tropical getaway featuring an outdoor swimming pool.",Expensive,9.2,Wonderful,71
https://www.booking.com/hotel/id/horison-seminyak.html?sid=b9709cd8ce176378f5bf317f22dd8ee4&aid=2230186&ucfs=1&arphpl=1&dest_id=835&dest_type=region&group_adults=2&req_adults=2&no_rooms=1&group_children=0&req_children=0&hpos=5&hapos=530&sr_order=popularity&srpvid=f0c23a7c639c0165&srepoch=1685175652&from_sustainable_property_sr=1&map_fdco=1&from=searchresults#hotelTmpl,Horison Seminyak Bali - CHSE Certified,"Double Six, Seminyak","A 2-minute walk from Seminyak shopping and dining area, Horison Seminyak Bali - CHSE Certified houses an outdoor swimming pool and spacious air-conditioned rooms.",Moderate,7.6,Good,525
https://www.booking.com/hotel/id/suka-sari-home-stay.html?sid=b9709cd8ce176378f5bf317f22dd8ee4&aid=2230186&ucfs=1&arphpl=1&dest_id=835&dest_type=region&group_adults=2&req_adults=2&no_rooms=1&group_children=0&req_children=0&hpos=6&hapos=531&sr_order=popularity&srpvid=f0c23a7c639c0165&srepoch=1685175652&map_fdco=1&from=searchresults#hotelTmpl,Suka Sari Cottages,Pemuteran,"Suka Sari Cottages is located in the Pemuteran area, a 5-minute drive from Pulaki Temple, and a 30-minute drive from Gilimanuk Harbor. It offers free on-site parking.",Cheap,9,Wonderful,70
https://www.booking.com/hotel/id/rumah-lada.html?sid=b9709cd8ce176378f5bf317f22dd8ee4&aid=2230186&ucfs=1&arphpl=1&dest_id=835&dest_type=region&group_adults=2&req_adults=2&no_rooms=1&group_children=0&req_children=0&hpos=7&hapos=532&sr_order=popularity&srpvid=f0c23a7c639c0165&srepoch=1685175652&from_sustainable_property_sr=1&map_fdco=1&from=searchresults#hotelTmpl,Canvas Escape Resort,Ubud,"Located in Ubud, 3.2 miles from Ubud Monkey Forest, Canvas Escape Resort provides accommodations with an outdoor swimming pool, free private parking, a garden and a terrace.",Cheap,8.4,Good,91
https://www.booking.com/hotel/id/passgo-digital-airport-bali.html?sid=b9709cd8ce176378f5bf317f22dd8ee4&aid=2230186&ucfs=1&arphpl=1&dest_id=835&dest_type=region&group_adults=2&req_adults=2&no_rooms=1&group_children=0&req_children=0&hpos=8&hapos=533&sr_order=popularity&srpvid=f0c23a7c639c0165&srepoch=1685175652&map_fdco=1&from=searchresults#hotelTmpl,PassGo Digital Airport Hotel Bali,"Tuban, Kuta",PassGo Digital Airport Hotel Bali features air-conditioned rooms with flat-screen TV in the Tuban district of Kuta.,Expensive,8.8,Exceptional,283
https://www.booking.com/hotel/id/kubu-d-39-ume-homestay.html?sid=b9709cd8ce176378f5bf317f22dd8ee4&aid=2230186&ucfs=1&arphpl=1&dest_id=835&dest_type=region&group_adults=2&req_adults=2&no_rooms=1&group_children=0&req_children=0&hpos=9&hapos=534&sr_order=popularity&srpvid=f0c23a7c639c0165&srepoch=1685175652&map_fdco=1&from=searchresults#hotelTmpl,KUBU D'UME HOMESTAY,Jatiluwih,"Located in Jatiluwih in the Bali region and Tanah Lot Temple reachable within 21 miles, KUBU D'UME HOMESTAY has accommodations with free WiFi, a playground, a garden and free private parking.",Expensive,9.6,Exceptional,151
https://www.booking.com/hotel/id/frii-bali-echo-beach.html?sid=b9709cd8ce176378f5bf317f22dd8ee4&aid=2230186&ucfs=1&arphpl=1&dest_id=835&dest_type=region&group_adults=2&req_adults=2&no_rooms=1&group_children=0&req_children=0&hpos=10&hapos=535&sr_order=popularity&srpvid=f0c23a7c639c0165&srepoch=1685175652&from_sustainable_property_sr=1&map_fdco=1&from=searchresults#hotelTmpl,FRii Bali Echo Beach,"Batu Bolong, Canggu","Located in Canggu, FRii Bali Echo Beach offers an outdoor pool and free WiFi access in all of the areas in the property.",Moderate,7.1,Good,439
https://www.booking.com/hotel/id/bay-shore-huts.html?sid=b9709cd8ce176378f5bf317f22dd8ee4&aid=2230186&ucfs=1&arphpl=1&dest_id=835&dest_type=region&group_adults=2&req_adults=2&no_rooms=1&group_children=0&req_children=0&hpos=11&hapos=536&sr_order=popularity&srpvid=f0c23a7c639c0165&srepoch=1685175652&map_fdco=1&from=searchresults#hotelTmpl,Bay Shore Huts - CHSE Certified,"Mushroom Bay, Nusa Lembongan","Enjoy an island escape at Bay Shore Huts, which offers amazing views of the sea.",Expensive,8.9,Exceptional,422
https://www.booking.com/hotel/id/bidadari-private-villas-retreat.html?sid=b9709cd8ce176378f5bf317f22dd8ee4&aid=2230186&ucfs=1&arphpl=1&dest_id=835&dest_type=region&group_adults=2&req_adults=2&no_rooms=1&group_children=0&req_children=0&hpos=12&hapos=537&sr_order=popularity&srpvid=f0c23a7c639c0165&srepoch=1685175652&from_sustainable_property_sr=1&map_fdco=1&from=searchresults#hotelTmpl,Bidadari Private Villas & Retreat,"Taman, Ubud",Bidadari Private Villas & Retreat offers villas set amid tropical greenery only 10 minutes from Ubud City Center. Certain villas have a private infinity pool overlooking the lush hill.,Expensive,9.4,Wonderful,334
https://www.booking.com/hotel/id/honeymoon-guesthouse.html?sid=b9709cd8ce176378f5bf317f22dd8ee4&aid=2230186&ucfs=1&arphpl=1&dest_id=835&dest_type=region&group_adults=2&req_adults=2&no_rooms=1&group_children=0&req_children=0&hpos=13&hapos=538&sr_order=popularity&srpvid=f0c23a7c639c0165&srepoch=1685175652&from_sustainable_property_sr=1&map_fdco=1&from=searchresults#hotelTmpl,Honeymoon Guesthouse,"Downtown Ubud, Ubud","Welcoming guests in Ubud with a relax and quaint atmosphere, Honeymoon Guest house is an accommodations with an outdoor salt-water swimming pool, a yoga studio, and a spa center.",Moderate,8.7,Exceptional,741
https://www.booking.com/hotel/id/the-arya-guest-house.html?sid=b9709cd8ce176378f5bf317f22dd8ee4&aid=2230186&ucfs=1&arphpl=1&dest_id=835&dest_type=region&group_adults=2&req_adults=2&no_rooms=1&group_children=0&req_children=0&hpos=14&hapos=539&sr_order=popularity&srpvid=f0c23a7c639c0165&srepoch=1685175652&from_sustainable_property_sr=1&map_fdco=1&from=searchresults#hotelTmpl,The Arya guest house,Gilimanuk,"Located in Gilimanuk, 1.1 miles from Gilimanuk Bay Beach, The Arya guest house has accommodations with a garden, free private parking and a terrace.",Moderate,8.4,Good,67
