source_href,name_hotel,region,description,price_label,rating,rating_type,review_count
https://www.booking.com/hotel/id/inaya-putri-bali-nusadua.html?sid=b9709cd8ce176378f5bf317f22dd8ee4&aid=2230186&ucfs=1&arphpl=1&dest_id=835&dest_type=region&group_adults=2&req_adults=2&no_rooms=1&group_children=0&req_children=0&hpos=20&hapos=270&sr_order=popularity&srpvid=f0c23a7c639c0165&srepoch=1685175631&from_sustainable_property_sr=1&map_fdco=1&from=searchresults#hotelTmpl,MERUSAKA Nusa Dua,"BTDC, Nusa Dua","Located along the beachfront Nusa Dua, a 15-minute walk from Bali Collection, MERUSAKA Nusa Dua offers modern and elegant accommodations with free in-room WiFi access. It features an outdoor pool.",Expensive,8.4,Good,"1,300"
https://www.booking.com/hotel/id/khaiyyara-jimbaran-bali.html?sid=b9709cd8ce176378f5bf317f22dd8ee4&aid=2230186&ucfs=1&arphpl=1&dest_id=835&dest_type=region&group_adults=2&req_adults=2&no_rooms=1&group_children=0&req_children=0&hpos=21&hapos=271&sr_order=popularity&srpvid=f0c23a7c639c0165&srepoch=1685175631&map_fdco=1&from=searchresults#hotelTmpl,Khaiyyara Jimbaran Bali,Badung,"Khaiyyara Jimbaran Bali features an outdoor swimming pool, terrace, a restaurant and bar in Badung. This 4-star hotel offers room service and a 24-hour front desk.",Expensive,8.4,Good,71
https://www.booking.com/hotel/id/bali-bobo.html?sid=b9709cd8ce176378f5bf317f22dd8ee4&aid=2230186&ucfs=1&arphpl=1&dest_id=835&dest_type=region&group_adults=2&req_adults=2&no_rooms=1&group_children=0&req_children=0&hpos=22&hapos=272&sr_order=popularity&srpvid=f0c23a7c639c0165&srepoch=1685175631&map_fdco=1&from=searchresults#hotelTmpl,Bali Bobo Hostel,"Bukit, Jimbaran","Located in Jimbaran, 2.3 miles from Samasta Lifestyle Village, Bali Bobo Hostel provides accommodations with an outdoor swimming pool, free private parking, a garden and a shared lounge.",Expensive,9.6,Exceptional,284
https://www.booking.com/hotel/id/adiwana-resort-jembawan.html?sid=b9709cd8ce176378f5bf317f22dd8ee4&aid=2230186&ucfs=1&arphpl=1&dest_id=835&dest_type=region&group_adults=2&req_adults=2&no_rooms=1&group_children=0&req_children=0&hpos=23&hapos=273&sr_order=popularity&srpvid=f0c23a7c639c0165&srepoch=1685175631&from_sustainable_property_sr=1&map_fdco=1&from=searchresults#hotelTmpl,Adiwana Resort Jembawan,"Downtown Ubud, Ubud","Set among tropical greenery in Ubud, Bali, Adiwana Resort Jembawan features an outdoor pool, a spa center and yoga facilities.",Cheap,9,Wonderful,660
https://www.booking.com/hotel/id/amnaya-resort-nusa-dua.html?sid=b9709cd8ce176378f5bf317f22dd8ee4&aid=2230186&ucfs=1&arphpl=1&dest_id=835&dest_type=region&group_adults=2&req_adults=2&no_rooms=1&group_children=0&req_children=0&hpos=24&hapos=274&sr_order=popularity&srpvid=f0c23a7c639c0165&srepoch=1685175631&from_sustainable_property_sr=1&map_fdco=1&from=searchresults#hotelTmpl,Amnaya Resort Nusa Dua,"Tanjung Benoa, Nusa Dua","Amnaya Resort Nusa Dua features an outdoor swimming pool, garden, a restaurant and bar in Nusa Dua. This 4-star hotel offers a concierge service and a tour desk.",Cheap,9.3,Wonderful,"1,064"
https://www.booking.com/hotel/id/le-48-zen.html?sid=b9709cd8ce176378f5bf317f22dd8ee4&aid=2230186&ucfs=1&arphpl=1&dest_id=835&dest_type=region&group_adults=2&req_adults=2&no_rooms=1&group_children=0&req_children=0&hpos=25&hapos=275&sr_order=popularity&srpvid=f0c23a7c639c0165&srepoch=1685175631&from_sustainable_property_sr=1&map_fdco=1&from=searchresults#hotelTmpl,The Forty Eight Resort Candidasa,Candidasa,"Offering air-conditioned cottages centered-around a pool, and surrounded by Eastern Bali peaceful greenery, The Forty Eight Resort Candidasa is just 164 feet from the ocean.",Expensive,8.5,Good,320
https://www.booking.com/hotel/id/b-bali.html?sid=b9709cd8ce176378f5bf317f22dd8ee4&aid=2230186&ucfs=1&arphpl=1&dest_id=835&dest_type=region&group_adults=2&req_adults=2&no_rooms=1&group_children=0&req_children=0&hpos=2&hapos=277&sr_order=popularity&srpvid=f0c23a7c639c0165&srepoch=1685175633&from_sustainable_property_sr=1&map_fdco=1&from=searchresults#hotelTmpl,b Hotel Bali & Spa,"Imam Bonjol, Denpasar","A 10-minute drive from Kuta Beach, b Hotel Bali is a contemporary minimalist-style hotel with a spa, and an outdoor pool. Free Wi-Fi throughout its premises.",Moderate,7.9,Good,359
https://www.booking.com/hotel/id/bali-relaxing-resort-and-spa.html?sid=b9709cd8ce176378f5bf317f22dd8ee4&aid=2230186&ucfs=1&arphpl=1&dest_id=835&dest_type=region&group_adults=2&req_adults=2&no_rooms=1&group_children=0&req_children=0&hpos=3&hapos=278&sr_order=popularity&srpvid=f0c23a7c639c0165&srepoch=1685175633&from_sustainable_property_sr=1&map_fdco=1&from=searchresults#hotelTmpl,Bali Relaxing Resort and Spa,"Tanjung Benoa, Nusa Dua",Located along Nusa Dua Beach Bali Relaxing Resort and Spa houses an outdoor swimming pool and 2 dining options. This beachfront property offers free drop-off to Tanjung Benoa and Nusa Dua areas.,Moderate,7.9,Good,801
https://www.booking.com/hotel/id/bobocabin-kintamani.html?sid=b9709cd8ce176378f5bf317f22dd8ee4&aid=2230186&ucfs=1&arphpl=1&dest_id=835&dest_type=region&group_adults=2&req_adults=2&no_rooms=1&group_children=0&req_children=0&hpos=4&hapos=279&sr_order=popularity&srpvid=f0c23a7c639c0165&srepoch=1685175633&map_fdco=1&from=searchresults#hotelTmpl,Bobocabin Kintamani,Kintamani,"Featuring 4-star accommodations, Bobocabin Kintamani is located in Kintamani, 20 miles from Tegallalang Rice Terrace and 26 miles from Goa Gajah.",Moderate,7.7,Good,96
https://www.booking.com/hotel/id/om-ham-retreat-ubud.html?sid=b9709cd8ce176378f5bf317f22dd8ee4&aid=2230186&ucfs=1&arphpl=1&dest_id=835&dest_type=region&group_adults=2&req_adults=2&no_rooms=1&group_children=0&req_children=0&hpos=5&hapos=280&sr_order=popularity&srpvid=f0c23a7c639c0165&srepoch=1685175633&from_sustainable_property_sr=1&map_fdco=1&from=searchresults#hotelTmpl,Om Ham Retreat and Resort,"Taman, Ubud","Strategically located just a 10-minute from Ubud Market and Ubud Royal Palace, Om Ham Retreat and Resort offers an outdoor swimming pool, free WiFi access in all areas of the property and free on-site...",Expensive,8.8,Exceptional,338
https://www.booking.com/hotel/id/tjampuhan-spa.html?sid=b9709cd8ce176378f5bf317f22dd8ee4&aid=2230186&ucfs=1&arphpl=1&dest_id=835&dest_type=region&group_adults=2&req_adults=2&no_rooms=1&group_children=0&req_children=0&hpos=6&hapos=281&sr_order=popularity&srpvid=f0c23a7c639c0165&srepoch=1685175633&map_fdco=1&from=searchresults#hotelTmpl,Hotel Tjampuhan Spa,"Sayan, Ubud","Hotel Tjampuhan Spa is located in Bali’s Ubud Area, overlooking Gunung Lembah Temple and Rivers Oos and Tjampuhan.",Cheap,8,Good,269
https://www.booking.com/hotel/id/queen-at-gunung-sari.html?sid=b9709cd8ce176378f5bf317f22dd8ee4&aid=2230186&ucfs=1&arphpl=1&dest_id=835&dest_type=region&group_adults=2&req_adults=2&no_rooms=1&group_children=0&req_children=0&hpos=7&hapos=282&sr_order=popularity&srpvid=f0c23a7c639c0165&srepoch=1685175633&from_sustainable_property_sr=1&map_fdco=1&from=searchresults#hotelTmpl,Queen at Gunung Sari,Ubud,"Located a 17-minute walk from Ubud Palace, Queen at Gunung Sari offers 3-star accommodations in Ubud and features a garden.",Moderate,9,Wonderful,336
https://www.booking.com/hotel/id/villa-pelangi-sidemen.html?sid=b9709cd8ce176378f5bf317f22dd8ee4&aid=2230186&ucfs=1&arphpl=1&dest_id=835&dest_type=region&group_adults=2&req_adults=2&no_rooms=1&group_children=0&req_children=0&hpos=8&hapos=283&sr_order=popularity&srpvid=f0c23a7c639c0165&srepoch=1685175633&from_sustainable_property_sr=1&map_fdco=1&from=searchresults#hotelTmpl,Pelangi Villas Sidemen,Sidemen,"In the heart of the Balinese countryside, with views of the mountains and gardens, Villa Pelangi Sideman offers an outdoor pool and villas with private terraces.",Expensive,8.9,Exceptional,213
https://www.booking.com/hotel/id/dream-beach-huts.html?sid=b9709cd8ce176378f5bf317f22dd8ee4&aid=2230186&ucfs=1&arphpl=1&dest_id=835&dest_type=region&group_adults=2&req_adults=2&no_rooms=1&group_children=0&req_children=0&hpos=9&hapos=284&sr_order=popularity&srpvid=f0c23a7c639c0165&srepoch=1685175633&map_fdco=1&from=searchresults#hotelTmpl,Dream Beach Huts,"Mushroom Bay, Nusa Lembongan","Located in the south coast of Lembongan Island, Dream Beach Huts offers spacious huts with a balcony. It features an outdoor pool overlooking the sea, and a private beach area.",Expensive,8.5,Good,757
https://www.booking.com/hotel/id/renaissance-bali-uluwatu-resort-spa.html?sid=b9709cd8ce176378f5bf317f22dd8ee4&aid=2230186&ucfs=1&arphpl=1&dest_id=835&dest_type=region&group_adults=2&req_adults=2&no_rooms=1&group_children=0&req_children=0&hpos=10&hapos=285&sr_order=popularity&srpvid=f0c23a7c639c0165&srepoch=1685175633&from_sustainable_property_sr=1&map_fdco=1&from=searchresults#hotelTmpl,Renaissance Bali Uluwatu Resort & Spa,"Pecatu, Uluwatu","Set in Uluwatu, Renaissance Bali Uluwatu Resort & Spa offers 5-star accommodations with an outdoor swimming pool and a fitness center.",Cheap,8.9,Exceptional,541
https://www.booking.com/hotel/id/bella-kita-mountain-retreat-amp-spa.html?sid=b9709cd8ce176378f5bf317f22dd8ee4&aid=2230186&ucfs=1&arphpl=1&dest_id=835&dest_type=region&group_adults=2&req_adults=2&no_rooms=1&group_children=0&req_children=0&hpos=11&hapos=286&sr_order=popularity&srpvid=f0c23a7c639c0165&srepoch=1685175633&map_fdco=1&from=searchresults#hotelTmpl,Bella Kita Mountain Retreat & Spa,Klungkung,"With mountain views, Bella Kita Mountain Retreat & Spa is located in Klungkung and has a restaurant, room service, bar, garden, year-round outdoor pool and terrace.",Cheap,8.5,Good,84
https://www.booking.com/hotel/id/nusa-veranda-sunset-villas-amp-restaurant.html?sid=b9709cd8ce176378f5bf317f22dd8ee4&aid=2230186&ucfs=1&arphpl=1&dest_id=835&dest_type=region&group_adults=2&req_adults=2&no_rooms=1&group_children=0&req_children=0&hpos=12&hapos=287&sr_order=popularity&srpvid=f0c23a7c639c0165&srepoch=1685175633&from_sustainable_property_sr=1&map_fdco=1&from=searchresults#hotelTmpl,Nusa Veranda Sunset Villas & Restaurant,"Nusa Ceningan, Nusa Lembongan","Located in Nusa Lembongan, a 11-minute walk from Song Tepo Beach, Nusa Veranda Sunset Villas & Restaurant provides accommodations with an outdoor swimming pool, free private parking, a garden and a...",Expensive,9.2,Wonderful,493
https://www.booking.com/hotel/id/blue-karma-resort.html?sid=b9709cd8ce176378f5bf317f22dd8ee4&aid=2230186&ucfs=1&arphpl=1&dest_id=835&dest_type=region&group_adults=2&req_adults=2&no_rooms=1&group_children=0&req_children=0&hpos=13&hapos=288&sr_order=popularity&srpvid=f0c23a7c639c0165&srepoch=1685175633&from_sustainable_property_sr=1&map_fdco=1&from=searchresults#hotelTmpl,Blue Karma Dijiwa Ubud,"Taman, Ubud","Welcoming guests with an outdoor swimming pool, Blue Karma dijiwa Ubud is located in central Ubud. It houses a 24-hour front desk, a tropical garden and a restaurant. Free WiFi is available...",Expensive,9,Wonderful,403
https://www.booking.com/hotel/id/alam-anda-ocean-front-resort-amp-spa.html?sid=b9709cd8ce176378f5bf317f22dd8ee4&aid=2230186&ucfs=1&arphpl=1&dest_id=835&dest_type=region&group_adults=2&req_adults=2&no_rooms=1&group_children=0&req_children=0&hpos=14&hapos=289&sr_order=popularity&srpvid=f0c23a7c639c0165&srepoch=1685175633&from_sustainable_property_sr=1&map_fdco=1&from=searchresults#hotelTmpl,Alam Anda Ocean Front Resort & Spa CHSE Certified,Tejakula,"Located at the beachfront of Gretek, Alam Anda Ocean Front Resort & Spa CHSE Certified offers modern and tranquil accommodations with free WiFi access.",Expensive,8.5,Good,49
https://www.booking.com/hotel/id/natya-resorts-ubud.html?sid=b9709cd8ce176378f5bf317f22dd8ee4&aid=2230186&ucfs=1&arphpl=1&dest_id=835&dest_type=region&group_adults=2&req_adults=2&no_rooms=1&group_children=0&req_children=0&hpos=15&hapos=290&sr_order=popularity&srpvid=f0c23a7c639c0165&srepoch=1685175633&from_sustainable_property_sr=1&map_fdco=1&from=searchresults#hotelTmpl,Natya Resort Ubud,"Taman, Ubud","Located in Ubud, 2.5 mi from Ubud Market, Natya Resort Ubud features an outdoor pool and barbecue.",Expensive,9.1,Wonderful,749
https://www.booking.com/hotel/id/dimpil-homestay.html?sid=b9709cd8ce176378f5bf317f22dd8ee4&aid=2230186&ucfs=1&arphpl=1&dest_id=835&dest_type=region&group_adults=2&req_adults=2&no_rooms=1&group_children=0&req_children=0&hpos=16&hapos=291&sr_order=popularity&srpvid=f0c23a7c639c0165&srepoch=1685175633&map_fdco=1&from=searchresults#hotelTmpl,Oma In Guest House Pemuteran Bali - Formerly Dimpil Homestay,Pemuteran,"With garden views, Oma In Guest House Pemuteran Bali - Formerly Dimpil Homestay is located in Pemuteran and has a restaurant, room service, bar, garden, year-round outdoor pool and terrace.",Expensive,9.1,Wonderful,105
https://www.booking.com/hotel/id/tanjung-alam-lovina.html?sid=b9709cd8ce176378f5bf317f22dd8ee4&aid=2230186&ucfs=1&arphpl=1&dest_id=835&dest_type=region&group_adults=2&req_adults=2&no_rooms=1&group_children=0&req_children=0&hpos=17&hapos=292&sr_order=popularity&srpvid=f0c23a7c639c0165&srepoch=1685175633&from_sustainable_property_sr=1&map_fdco=1&from=searchresults#hotelTmpl,RedDoorz at Tanjung Alam Hotel Lovina,Buleleng,"RedDoorz at Tanjung Alam Hotel Lovina has an outdoor swimming pool, garden, a terrace and restaurant in Buleleng. The hotel features family rooms.",Moderate,7.2,Good,4
https://www.booking.com/hotel/id/ganesh-lodge.html?sid=b9709cd8ce176378f5bf317f22dd8ee4&aid=2230186&ucfs=1&arphpl=1&dest_id=835&dest_type=region&group_adults=2&req_adults=2&no_rooms=1&group_children=0&req_children=0&hpos=18&hapos=293&sr_order=popularity&srpvid=f0c23a7c639c0165&srepoch=1685175633&from_sustainable_property_sr=1&map_fdco=1&from=searchresults#hotelTmpl,Ganesh Lodge,Candidasa,"Set in Candidasa, Ganesh Lodge features a garden and a free form outdoor pool. Among the facilities of this property are a restaurant, a 24-hour front desk and a concierge service.",Expensive,8.6,Exceptional,248
https://www.booking.com/hotel/id/pinggan-caldera.html?sid=b9709cd8ce176378f5bf317f22dd8ee4&aid=2230186&ucfs=1&arphpl=1&dest_id=835&dest_type=region&group_adults=2&req_adults=2&no_rooms=1&group_children=0&req_children=0&hpos=19&hapos=294&sr_order=popularity&srpvid=f0c23a7c639c0165&srepoch=1685175633&from_sustainable_property_sr=1&map_fdco=1&from=searchresults#hotelTmpl,Pinggan caldera,Baturaja,"Featuring an outdoor swimming pool, a garden, and a terrace, Pinggan caldera has accommodations in Baturaja with free WiFi and mountain views.",Expensive,8.9,Exceptional,77
https://www.booking.com/hotel/id/padi-bali-villas.html?sid=b9709cd8ce176378f5bf317f22dd8ee4&aid=2230186&ucfs=1&arphpl=1&dest_id=835&dest_type=region&group_adults=2&req_adults=2&no_rooms=1&group_children=0&req_children=0&hpos=20&hapos=295&sr_order=popularity&srpvid=f0c23a7c639c0165&srepoch=1685175633&from_sustainable_property_sr=1&map_fdco=1&from=searchresults#hotelTmpl,Padi Bali Eco Villas,Payangan,"Featuring free WiFi and a restaurant, Padi Bali Eco Villas offers accommodations in Payangan, 3.1 mi from Elephant Safari Park. Free private parking is available on site.",Expensive,8.7,Exceptional,148
https://www.booking.com/hotel/id/best-western-kamala-jimbaran.html?sid=b9709cd8ce176378f5bf317f22dd8ee4&aid=2230186&ucfs=1&arphpl=1&dest_id=835&dest_type=region&group_adults=2&req_adults=2&no_rooms=1&group_children=0&req_children=0&hpos=21&hapos=296&sr_order=popularity&srpvid=f0c23a7c639c0165&srepoch=1685175633&map_fdco=1&from=searchresults#hotelTmpl,Best Western Kamala Jimbaran,"Bukit, Jimbaran","Located 0.6 mi from Garuda Wisnu Kencana, Best Western Kamala Jimbaran offers accommodations with a number of modern amenities.",Expensive,8.3,Good,357
https://www.booking.com/hotel/id/waka-shorea-resort.html?sid=b9709cd8ce176378f5bf317f22dd8ee4&aid=2230186&ucfs=1&arphpl=1&dest_id=835&dest_type=region&group_adults=2&req_adults=2&no_rooms=1&group_children=0&req_children=0&hpos=22&hapos=297&sr_order=popularity&srpvid=f0c23a7c639c0165&srepoch=1685175633&from_sustainable_property_sr=1&map_fdco=1&from=searchresults#hotelTmpl,NusaBay Menjangan,Banyuwedang,"Boasting rustic rooms surrounded by nature and wildlife, NusaBay Menjangan is the only resort located within West Bali National Park.",Moderate,9.2,Wonderful,229
https://www.booking.com/hotel/id/new-chakra.html?sid=b9709cd8ce176378f5bf317f22dd8ee4&aid=2230186&ucfs=1&arphpl=1&dest_id=835&dest_type=region&group_adults=2&req_adults=2&no_rooms=1&group_children=0&req_children=0&hpos=23&hapos=298&sr_order=popularity&srpvid=f0c23a7c639c0165&srepoch=1685175633&from_sustainable_property_sr=1&map_fdco=1&from=searchresults#hotelTmpl,Chakra Tavern,Bedugul,"Located in Bedugul, 26 miles from Blanco Museum, Chakra Tavern has accommodations with a garden, free private parking, a shared lounge and a terrace.",Expensive,9.5,Exceptional,67
https://www.booking.com/hotel/id/kompyang-cottage.html?sid=b9709cd8ce176378f5bf317f22dd8ee4&aid=2230186&ucfs=1&arphpl=1&dest_id=835&dest_type=region&group_adults=2&req_adults=2&no_rooms=1&group_children=0&req_children=0&hpos=24&hapos=299&sr_order=popularity&srpvid=f0c23a7c639c0165&srepoch=1685175633&from_sustainable_property_sr=1&map_fdco=1&from=searchresults#hotelTmpl,Kompyang Cottage,Nusa Penida,"Located a 6-minute walk from Batununggul Rastafara Beach, Kompyang Cottage has accommodations with an outdoor swimming pool, a garden and room service for your convenience. Free WiFi is available.",Moderate,9.3,Wonderful,348
https://www.booking.com/hotel/id/sakti-garden-resort-amp-spa.html?sid=b9709cd8ce176378f5bf317f22dd8ee4&aid=2230186&ucfs=1&arphpl=1&dest_id=835&dest_type=region&group_adults=2&req_adults=2&no_rooms=1&group_children=0&req_children=0&hpos=25&hapos=300&sr_order=popularity&srpvid=f0c23a7c639c0165&srepoch=1685175633&from_sustainable_property_sr=1&map_fdco=1&from=searchresults#hotelTmpl,Sakti Garden Resort & Spa,"Taman, Ubud","Located in Ubud, 1.2 miles from Ubud Palace, Sakti Garden Resort & Spa has accommodations with an outdoor swimming pool, free private parking, a garden and a terrace.",Cheap,9.5,Exceptional,114
https://www.booking.com/hotel/id/sakti-garden-resort-amp-spa.html?sid=b9709cd8ce176378f5bf317f22dd8ee4&aid=2230186&ucfs=1&arphpl=1&dest_id=835&dest_type=region&group_adults=2&req_adults=2&no_rooms=1&group_children=0&req_children=0&hpos=2&hapos=302&sr_order=popularity&srpvid=f0c23a7c639c0165&srepoch=1685175635&from_sustainable_property_sr=1&map_fdco=1&from=searchresults#hotelTmpl,Sakti Garden Resort & Spa,"Taman, Ubud","Located in Ubud, 1.2 miles from Ubud Palace, Sakti Garden Resort & Spa has accommodations with an outdoor swimming pool, free private parking, a garden and a terrace.",Expensive,9.5,Exceptional,114
https://www.booking.com/hotel/id/relax-bali-residence-villas.html?sid=b9709cd8ce176378f5bf317f22dd8ee4&aid=2230186&ucfs=1&arphpl=1&dest_id=835&dest_type=region&group_adults=2&req_adults=2&no_rooms=1&group_children=0&req_children=0&hpos=3&hapos=303&sr_order=popularity&srpvid=f0c23a7c639c0165&srepoch=1685175635&from_sustainable_property_sr=1&map_fdco=1&from=searchresults#hotelTmpl,Relax Bali Dive & SPA Resort,Tulamben,"With sea views, Relax Bali Dive & SPA Resort is located in Tulamben and has a restaurant, a shared lounge, bar, garden, year-round outdoor pool and terrace.",Moderate,9,Wonderful,76
https://www.booking.com/hotel/id/sunrise-lodge-amp-lounge.html?sid=b9709cd8ce176378f5bf317f22dd8ee4&aid=2230186&ucfs=1&arphpl=1&dest_id=835&dest_type=region&group_adults=2&req_adults=2&no_rooms=1&group_children=0&req_children=0&hpos=4&hapos=304&sr_order=popularity&srpvid=f0c23a7c639c0165&srepoch=1685175635&map_fdco=1&from=searchresults#hotelTmpl,Sunrise Lodge & Lounge,Singaraja,"Located in Singaraja, a 1-minute walk from Happy Beach Tukad Mungga and 0.6 miles from Pemaron Beach, Sunrise Lodge & Lounge has accommodations with free WiFi and a garden with a terrace and garden...",Moderate,7.9,Good,118
https://www.booking.com/hotel/id/umae-villa.html?sid=b9709cd8ce176378f5bf317f22dd8ee4&aid=2230186&ucfs=1&arphpl=1&dest_id=835&dest_type=region&group_adults=2&req_adults=2&no_rooms=1&group_children=0&req_children=0&hpos=5&hapos=305&sr_order=popularity&srpvid=f0c23a7c639c0165&srepoch=1685175635&map_fdco=1&from=searchresults#hotelTmpl,Umae Villa Ubud,"Pengosekan, Ubud","A 3-minute walk from Monkey Forest, Umae Villa Ubud offers a private retreat surrounded by beautiful rice fields. The property also offers free WiFi access and a private pool.",Moderate,7.7,Good,133
https://www.booking.com/hotel/id/bali-beach-glamping.html?sid=b9709cd8ce176378f5bf317f22dd8ee4&aid=2230186&ucfs=1&arphpl=1&dest_id=835&dest_type=region&group_adults=2&req_adults=2&no_rooms=1&group_children=0&req_children=0&hpos=6&hapos=306&sr_order=popularity&srpvid=f0c23a7c639c0165&srepoch=1685175635&from_sustainable_property_sr=1&map_fdco=1&from=searchresults#hotelTmpl,Bali Beach Glamping,Tabanan,"With Pig Stone Beach reachable in a few steps, Bali Beach Glamping has accommodations, a restaurant, an outdoor swimming pool, a garden and a terrace.",Expensive,8.7,Exceptional,143
https://www.booking.com/hotel/id/hilton-garden-inn-bali-ngurah-rai-airport.html?sid=b9709cd8ce176378f5bf317f22dd8ee4&aid=2230186&ucfs=1&arphpl=1&dest_id=835&dest_type=region&group_adults=2&req_adults=2&no_rooms=1&group_children=0&req_children=0&hpos=7&hapos=307&sr_order=popularity&srpvid=f0c23a7c639c0165&srepoch=1685175635&from_sustainable_property_sr=1&map_fdco=1&from=searchresults#hotelTmpl,Hilton Garden Inn Bali Ngurah Rai Airport,"Tuban, Kuta","Conveniently located 1640 feet away from Bali Denpasar International Airport, Hilton Garden Inn Bali Ngurah Rai Airport features a landscaped outdoor pool, a kids' pool and a 24-hour fitness center.",Moderate,7.5,Good,"1,568"
https://www.booking.com/hotel/id/dive-inn-bali.html?sid=b9709cd8ce176378f5bf317f22dd8ee4&aid=2230186&ucfs=1&arphpl=1&dest_id=835&dest_type=region&group_adults=2&req_adults=2&no_rooms=1&group_children=0&req_children=0&hpos=8&hapos=308&sr_order=popularity&srpvid=f0c23a7c639c0165&srepoch=1685175635&map_fdco=1&from=searchresults#hotelTmpl,Pebble & Fins Bali Dive Resort,Tulamben,"Located in Tulamben, a 18-minute walk from Baturinggit Beach, Pebble & Fins Bali Dive Resort has accommodations with an outdoor swimming pool, free private parking, a garden and a terrace.",Expensive,9.1,Wonderful,57
https://www.booking.com/hotel/id/bintang-hostel-and-homestay.html?sid=b9709cd8ce176378f5bf317f22dd8ee4&aid=2230186&ucfs=1&arphpl=1&dest_id=835&dest_type=region&group_adults=2&req_adults=2&no_rooms=1&group_children=0&req_children=0&hpos=9&hapos=309&sr_order=popularity&srpvid=f0c23a7c639c0165&srepoch=1685175635&map_fdco=1&from=searchresults#hotelTmpl,Bintang Hostel and Homestay,Nusa Penida,"Located in Nusa Penida, 1.2 miles from Crystal Bay Beach, Bintang Hostel and Homestay provides accommodations with free WiFi and free private parking.",Moderate,8.8,Exceptional,281
https://www.booking.com/hotel/id/dream-breeze-village-by-bukit-vista.html?sid=b9709cd8ce176378f5bf317f22dd8ee4&aid=2230186&ucfs=1&arphpl=1&dest_id=835&dest_type=region&group_adults=2&req_adults=2&no_rooms=1&group_children=0&req_children=0&hpos=10&hapos=310&sr_order=popularity&srpvid=f0c23a7c639c0165&srepoch=1685175635&map_fdco=1&from=searchresults#hotelTmpl,Dream Breeze Village by Bukit Vista,Badung,"Located in Badung and with Nunggalan Beach reachable within 1.3 miles, Dream Breeze Village by Bukit Vista has a garden, non-smoking rooms, free WiFi and a terrace.",Moderate,9.2,Wonderful,32
https://www.booking.com/hotel/id/padang-padang-inn.html?sid=b9709cd8ce176378f5bf317f22dd8ee4&aid=2230186&ucfs=1&arphpl=1&dest_id=835&dest_type=region&group_adults=2&req_adults=2&no_rooms=1&group_children=0&req_children=0&hpos=11&hapos=311&sr_order=popularity&srpvid=f0c23a7c639c0165&srepoch=1685175635&from_sustainable_property_sr=1&map_fdco=1&from=searchresults#hotelTmpl,Padang-Padang Inn,"Padang Padang, Uluwatu","Featuring a large outdoor pool and a spa center, Padang-Padang Inn is located in Pecatu in the Bali Region, 1.5 mi from New Kuta Green Park. Guests can enjoy the on-site restaurant.",Moderate,8.4,Good,599
https://www.booking.com/hotel/id/courtyard-bali-nusa-dua.html?sid=b9709cd8ce176378f5bf317f22dd8ee4&aid=2230186&ucfs=1&arphpl=1&dest_id=835&dest_type=region&group_adults=2&req_adults=2&no_rooms=1&group_children=0&req_children=0&hpos=12&hapos=312&sr_order=popularity&srpvid=f0c23a7c639c0165&srepoch=1685175635&from_sustainable_property_sr=1&map_fdco=1&from=searchresults#hotelTmpl,Courtyard by Marriott Bali Nusa Dua Resort,"BTDC, Nusa Dua","Featuring a large landscaped lagoon pool bordered by sun loungers, the 5-star Courtyard by Mariott Bali Nusa Dua Resort houses 24/7 fitness facilities, a beach club and 5 dining venues.",Expensive,8.6,Exceptional,708
https://www.booking.com/hotel/id/prana-dewi-mountain-resort.html?sid=b9709cd8ce176378f5bf317f22dd8ee4&aid=2230186&ucfs=1&arphpl=1&dest_id=835&dest_type=region&group_adults=2&req_adults=2&no_rooms=1&group_children=0&req_children=0&hpos=13&hapos=313&sr_order=popularity&srpvid=f0c23a7c639c0165&srepoch=1685175635&from_sustainable_property_sr=1&map_fdco=1&from=searchresults#hotelTmpl,Prana Dewi Mountain Resort,Jatiluwih,"Located in Jatiluwih, 21 miles from Tanah Lot Temple, Prana Dewi Mountain Resort has accommodations with an outdoor swimming pool, free private parking, a garden and a terrace.",Expensive,8.5,Good,56
https://www.booking.com/hotel/id/beehouse-dijiwa-ubud.html?sid=b9709cd8ce176378f5bf317f22dd8ee4&aid=2230186&ucfs=1&arphpl=1&dest_id=835&dest_type=region&group_adults=2&req_adults=2&no_rooms=1&group_children=0&req_children=0&hpos=14&hapos=314&sr_order=popularity&srpvid=f0c23a7c639c0165&srepoch=1685175635&from_sustainable_property_sr=1&map_fdco=1&from=searchresults#hotelTmpl,Beehouse Dijiwa Ubud,"Peliatan, Ubud","With pool views, Beehouse Dijiwa Ubud is located in Ubud and has a restaurant, room service, bar, garden, year-round outdoor pool and terrace. The accommodations feature a hot tub.",Expensive,9.2,Wonderful,220
